brand,color,desc,retailPrice,title
Parisian,grey,Mini dress by Parisian    The scroll is overCheck design     Peak lapels     Long sleeves    Double-breasted styleButton placketRegular fitTrue to size,20,Parisian blazer dress in check
New Girl Order,black,Dress by New Girl Order    File under: staplesCrew neckDrop shouldersPrawn print to reverseRelaxed fitSlouchy cut ,12.65,New Girl Order prawn back print t-shirt dress
Y.A.S,yellow,Mini dress by Y.A.S    Coming soon to your Saved ItemsV-neckPuff sleevesSmock styleRelaxed fitFalls loosely over the body,28.55,Y.A.S smock dress with puff sleeves in yellow floral
Stradivarius,purple,Midi dress by Stradivarius    Your new favorite dressPlaid design     Square neck    Adjustable straps    Ruffle trim    Smock styleRegular fitTrue to sizeExclusive to ASOS,22.5,Stradivarius strappy shirred midi dress in lilac gingham
ASOS DESIGN,aubergine,Mini dress by ASOS DESIGN    Dressed to chillPlain designRound neckDrop shouldersOversized fitRelaxed and roomy,10.15,ASOS DESIGN oversized long sleeve t-shirt dress in aubergine
ASOS Curve,black,Plus-size dress by ASOS DESIGN          Serious add-to-bag potentialCrew neckDrop shouldersFaux-leather panelOversized fitRelaxed and roomy,16.2,ASOS DESIGN Curve oversized t-shirt dress in half leather-look in black
Only,red,Dress by Only    Crack the dress codeAll-over floral printHigh neckLong sleevesBelted waistButton-keyhole backRegular fitTrue to size,24.7,Only high neck belted skater dress mini in red autumnal floral
Miss Selfridge,black,Mini dress by Miss Selfridge    Cute dressAll-over floral printV-neckShort sleevesStretch cuffsRuffle trimsSmock styleRegular fitTrue to size,18,Miss Selfridge v-neck ruffle detail smock dress in black & blue floral
ASOS Petite,black,Petite dress by ASOS DESIGN         File under: staplesCrew neckLong sleevesSlim fitClose-fitting cut ,11.25,ASOS DESIGN Petite crew neck ribbed midi dress
River Island,blues,Dress by River Island    Très chicAll-over animal printCrew neckVolume sleevesFitted cuffsFront splitRegular fitTrue to size,26.8,River Island zebra print midi dress in blue
ASOS Curve,black,Plus-size dress by ASOS DESIGN          The scroll is overJacquard spot pattern    High neck    Long sleeves    Elasticated cuffs    Tie waistButton-keyhole backRegular fitTrue to size,27,ASOS DESIGN Curve high neck mini dress in jacqaurd chiffon with tie detail
Only,ditsy floral,Mini dress by Only    Your new go-to dressFloral printV-neckThree-quarter-length sleevesBelted waistRegular fit True to size,15.2,Only mini dress with belted waist in mixed ditsy floral
AX Paris,cream,Dress by AX Paris    Go with the fauxV-neckPuff sleevesWrap frontRuched sidesZip-back fastening Body-Conscious fit Figure-hugging cut ,51,AX Paris gathered side faux leather mini dress in cream
New Look Plus,blues,Plus-size dress by New Look          The scroll is overCheck design     Spread collarPartial button placket     Long sleeves    Smock styleRegular fitTrue to size,27.3,New Look Curve button front plaid smock mini dress in blue pattern
ASOS Maternity,blue/black stripe,Maternity dress by ASOS DESIGN    Cute dressStriped designRound neckDrop shouldersLong sleevesSmock styleSuper-oversized fitDesigned to fit you from bump to baby,28.8,ASOS DESIGN Maternity super oversized long sleeve smock dress in dusty blue and black stripe
Y.A.S,ditsy floral print,Dress by Y.A.S    Cute dressAll-over ditsy floral printSpread collarPartial button placketPuff sleevesRuffle trimSmock styleRelaxed fitLoose cut,75,Y.A.S smock shirt dress in floral print
ASOS DESIGN,sage green,Mini dress by ASOS DESIGN    Serving laid-back luxeMarl designRoll-neckDrop shouldersFitted cuffsRelaxed fitSlouchy cut,16,ASOS DESIGN super soft long sleeve roll neck mini dress in sage green heather
Wednesday's Girl,washed black,Dress by Wednesday's Girl    Cute dressV-neckWrap frontLong sleevesTie sideRegular fitTrue to sizeExclusive to ASOS,15.2,Wednesday's Girl long sleeve mini wrap dress in washed denim
ASOS Maternity,black,Maternity dress by ASOS DESIGN    Serious add-to-bag potential     Double-layer design ideal for nursing     Round neckLong sleevesWrap frontRegular fit    Designed to fit you from bump to baby,14.4,ASOS DESIGN Maternity Nursing mini wrap dress with long sleeves in polka dot
ASOS Tall,washed black,Tall dress by ASOS DESIGN    Part of our responsible edit Spread collarShort sleevesButton-through frontRegular fitTrue to size,34.4,ASOS DESIGN Tall soft denim smock shirt dress in washed black
ASOS Tall,green/yellow floral,Tall dress by ASOS DESIGN    Cute dressAll-over floral printCrew neckAngel sleevesRegular fitTrue to size,20.7,ASOS DESIGN Tall mini plisse crew neck dress in green and yellow floral
JDY,multi,Midi dress by JDY     The scroll is overFloral print     Spread collar     Long sleeves    Button cuffsButton-through front     Regular fitTrue to size,21,JDY midi shirt dress in black
TFNC Tall,mink,Tall dress by TFNC    Destination: dancefloor    One-shoulder design     Sleeveless style    Zip-side fasteningWrap skirt Asymmetric hem     Regular fitTrue to size,64,TFNC Tall Bridesmaid one shoulder maxi dress in mink
Vero Moda,night sky,Midi dress by Vero Moda     Crack the dress codeJacquard spot patternTiered designHigh neckSleeveless styleTie-keyhole backRegular fitTrue to size,40,Vero Moda midi smock dress in navy
Brave Soul Plus,gray heather,Plus-size dress by Brave Soul    Act casualDrawstring hoodOverhead designDrop shouldersPouch pocketRibbed trimsRelaxed fitSlouchy cut,23,Brave Soul Plus raku hooded sweat dress in gray heather
Lola May,black,Dress by Lola May    Coming soon to your Saved ItemsNotch collarLong sleevesPartial button placketTie waistRuffle hemRegular fitTrue to size,24.8,Lola May midi dress with volume sleeves and tie waist
Flounce London,camel,Dress by Flounce London    Serious add-to-bag potential High neckLong sleevesBody-Conscious fit Figure-hugging cut ,12,Flounce London basic ribbed roll neck long sleeve dress in camel
New Look,black pattern,Dress by New Look    Cute dressCheck designRound neckShort sleevesButton-keyhole backRegular fitTrue to size,14.05,New Look puff sleeve tunic mini dress in black plaid
Chi Chi London,brown,Mini dress by Chi Chi London    Serious add-to-bag potentialAll-over zebra printCrew neckBlouson sleevesElasticated cuffsPeplum hemRegular fitTrue to size,34.8,Chi Chi London tiger print smock mini dress in brown
Collusion,khaki,Mini dress by COLLUSION    Your new favorite dress    Crew neck    Drop shoulders    Corset-style waistRegular fitTrue to size,25.6,COLLUSION corset detail long sleeve t-shirt dress in khaki
Brave Soul Tall,tan,Tall dress by Brave Soul    Still not over animal printLeopard designContrast crew neckShort sleevesRegular fitTrue to size,14,Brave Soul Tall Cola leopard contrast ringer T-shirt dress
ASOS DESIGN,lilac,Mini dress by ASOS DESIGN    Say it with your chestCrew neckDrop shouldersVolume sleeves'Adios Bitches!' slogan printPanda scooter graphicRibbed trimsOversized fitRelaxed and roomy,16,ASOS DESIGN Petite oversized mini sweat dress with panda adios logo in lilac
TFNC Maternity,mink,Maternity dress by TFNCCue the group photoshootPleated design HalterneckSleeveless styleKeyhole front Thigh split Zip-back fasteningRegular fitDesigned to fit you from bump to baby,67,TFNC Maternity Bridesmaid pleated maxi dress in mink
ASOS DESIGN,silver,Midi dress by ASOS DESIGN    No occasion necessary   Round neck Long sleevesZip-back fasteningRegular fit True to size,23.7,ASOS DESIGN long sleeve pleated puff sleeve burnout mini dress
Milk It,white,Dress by Milk It    Worn and shot by one of our models at home Crew neckDrop shouldersGraphic print to chestOrganza hemRelaxed fitSlouchy cut#AtHomeWithASOS ,44.8,Milk It vintage t-shirt dress with organza hem and graphic heart print
ASOS Curve,gray ditsy floral,Plus-size dress by ASOS DESIGN          Cute dressAll-over floral printV-neckThree-quarter-length sleevesSwing styleRegular fitTrue to size,28.8,ASOS DESIGN Curve mini v neck swing dress in blue ditsy floral
ASOS Petite,winter white,Petite dress by ASOS DESIGN         Crack the dress codeHigh neckCut-out panelLong sleevesRegular fitTrue to size,32,ASOS DESIGN Petite super soft mini dress with cut out front with long sleeves in winter white
JDY,black,Mini dress by JDY    Laid-back looksRound neckPuff sleevesFitted cuffsRelaxed fitSlouchy cut,16.8,JDY denim mini dress with puff sleeves in black
ASOS Tall,black/white spot,Tall dress by ASOS DESIGN    Crack the dress codeAll-over polka-dot print V-neckBlouson sleevesElasticated cuffsTiered hem Smock styleRelaxed fit Loose cut ,36.4,ASOS DESIGN Tall textured tiered midi smock dress in polka dot
ASOS Curve,black,Plus-size dress by ASOS DESIGN       Dress it up or downDeep V-neckBlouson sleeves with stretch cuffsAdjustable tie waistRelaxed fitA little bit slouchy ,21.6,ASOS DESIGN Curve v neck ruched waist chuck on midi dress with long sleeves in black
Chi Chi London Petite,white,Petite dress by Chi Chi London         Dress casual? No thanksFloral-lace designRound neckShort sleevesPleated skirtButton-keyhole backZip-back fasteningRegular fitTrue to size,78.65,Chi Chi London Petite lace maxi dress with scalloped back in white
Missguided,green,Midi dress by MissguidedCrack the dress codeAll-over dalmatian printV-neckPartial button placketLong sleevesThigh splitTie detail to backZip-side fasteningRegular fitTrue to size,18,Missguided midi tea dress in green dalmatian print
ASOS DESIGN,grey,Midi dress by ASOS DESIGN     Crack the dress codePlain designPlunge neckLong sleevesLow back with chain detailSlim fitClose-fitting cut,18,ASOS DESIGN plunge rib midi dress with back chain detail in gray
ASOS DESIGN,oxblood,Midi dress by ASOS DESIGN     Très chicRibbed designSweetheart neckLong sleevesSlim fitClose-fitting cut,16,ASOS DESIGN Curve ribbed panel long sleeve midi dress in oxblood
ASOS Maternity,blue/white stripe,Maternity dress by ASOS DESIGN    Coming soon to your Saved ItemsStriped designSpread collarButton placketLong sleevesButton cuffsRelaxed fit    Designed to fit you from bump to baby,18,ASOS DESIGN Maternity cotton poplin oversized boyfriend mini shirt dress in stripe
ASOS DESIGN,mono,Midi dress by ASOS DESIGNTrès chicFloral printV-neckPadded shouldersLong sleevesTie-keyhole backMidi lengthRegular fit True to size,17.25,ASOS DESIGN plisse midi dress with tie back in black and white floral print
Missguided Plus,black,Plus-size dress by Missguided          Your new go-toPlain designHigh neck Partial zip fastening Drop shouldersRelaxed fit Slouchy cut,25.6,Missguided Plus zip front sweat dress in black
New Look Petite,black,Petite dress by New Look         Coming soon to your Saved Items    Crew neck    Long sleeves    Tie waist Slim fitClose-fitting cut ,11.9,New Look Petite long sleeve ribbed tie front midi dress in black
ASOS DESIGN,mocha,Mini dress by ASOS DESIGN    Coming soon to your Saved Items    Crew neck    Padded shoulders     Sleeveless style     Slogan print to chest     Relaxed fitSlouchy cut,9.6,ASOS DESIGN padded shoulder sleeveless t-shirt dress with you are the sun print in taupe
Daisy Street,black,Mini dress by Daisy Street    Cute dressAll-over daisy printRound neckLong sleevesRibbed cuffsPeplum hemRegular fitTrue to size,12.25,Daisy Street mini dress with peplum hem in daisy print
ASOS Maternity,navy,"Maternity dress by ASOS DESIGN    Cute dressAll-over embroidered pattern High neck Blouson sleevesShirred, stretch waist Button-keyhole back Zip-back fastening     Regular fit     Designed to fit you from bump to baby",35.55,ASOS DESIGN Maternity Lace Victorianna dress in navy
ASOS DESIGN,black dots,Mini dress by ASOS DESIGN    Cute dressPolka-dot design Square neck Short sleevesRuffle cuffsSmock style Regular fitTrue to size,17.5,ASOS DESIGN square neck mini smock dress with ruffle sleeve in black spot print
In The Style,red,Mini dress by In The Style    Cue the party playlistV-neckRuched shoulder strapsDraped frontZip-back fasteningBody-Conscious fitFigure-hugging cutExclusive to ASOS,17.3,In The Style exclusive velvet twist one shoulder ruched detail pencil dress in red
ASOS DESIGN,lilac,Mini dress by ASOS DESIGN    Part of our responsible editHigh neckVolume sleevesButton cuffsContrast frill trimsRegular fitTrue to size,30.15,ASOS DESIGN cord and poplin pie crust neck mini dress in lilac
JDY,medium blue denim,Mini dress by JDY    The scroll is over    Collarless style    Long sleeves    Press-stud front Regular fitTrue to size,18,JDY button detail denim mini dress in blue
Stradivarius,brown,Mini dress by Stradivarius    Crack the dress codeAnimal print    V-neckShort sleeves    Elasticated cuffs     Wrap frontStretch waistRuffle trimRegular fitTrue to size,18.1,Stradivarius mini dress with ruffle in brown animal print
Pieces,multi,Midi dress by PIECES     Cute dressAll-over smudge printNotch collarPartial button placketLong sleevesButton cuffsGathered waistRelaxed fitLoose cut,36.4,PIECES mini smock shirt dress in black smudge print
ASOS DESIGN,green,Midi dress by ASOS DESIGN     The scroll is overSweetheart neckPuff sleevesWrap front Contrast stitching Regular fit True to size ,41.6,ASOS DESIGN puff sleeve prom midi dress with contrast topstitch in green
Another Reason,brown zebra,Dress by Another Reason    Still not over animal print Square neckPuff sleevesElasticated cuffsTie frontThigh-high splitRegular fitTrue to size,19.2,Another Reason maxi tea dress in satin brown zebra print
ASOS DESIGN,multi,Mini dress by ASOS DESIGN    Coming soon to your Saved Items    Polka-dot printRuched designSweetheart neckLong sleevesLow-cut backBody-Conscious fitFigure-hugging cut,21,ASOS DESIGN long sleeve sweetheart ruched mini dress in green black spot
ASOS DESIGN,mono check,Mini dress by ASOS DESIGN    Cute dress Gingham design V-neckThree-quarter-length sleeves Dropped waist Smock style Relaxed fit Slouchy cut ,22.95,ASOS DESIGN mini smock with v neck in black and white gingham print
ASOS Curve,black,"Plus-size dress by ASOS DESIGN          No occasion necessaryRound, gathered neckVolume sleevesStretch cuffsButton-keyhole backSwing style Relaxed fitSlouchy cut",19.8,ASOS DESIGN Curve leather look swing mini dress in black
ASOS DESIGN,pink/black gingham,Mini dress by ASOS DESIGN    Cute dressGingham design High neck Blouson sleevesElasticated cuffsPeplum hem Button-keyhole backRelaxed fit Loose cut ,19.6,ASOS DESIGN gingham mini smock dress
River Island,black,Midi dress by River Island     Serving laid-back luxeRibbed designSquare neckLong sleevesThigh splitSlim fitClose-fitting cut,42.4,River Island square neck ribbed midi dress in black
ASOS Curve,green,"Plus-size dress by ASOS DESIGN          The baggier, the betterCrew neckDrop shouldersFitted cuffsSmock style Oversized fitRelaxed and roomy",12.8,ASOS DESIGN Curve oversized smock back sweatshirt dress in green
AX Paris,cheetah,Dress by AX Paris     The scroll is overAnimal print    Spread collarLong sleeves    Button-through frontTie waistRegular fitTrue to size,56,AX Paris midi shirt dress in cheetah
ASOS DESIGN,navy,Dress by ASOS DESIGN    Act casual High neckBalloon sleevesElasticated cuffsPleat detailing Ribbed hemOversized fitRelaxed and roomy ,12.6,ASOS DESIGN oversized balloon sleeve sweatshirt dress in navy
Influence,white/black,Mini dress by Influence    Cute dressPolka-dot printHigh neckPuff sleevesFrill bib detailButton-keyhole backSmock styleRelaxed fitLoose cut ,22.4,Influence ruffle bib mini dress in polka dot
ASOS DESIGN,stone,Midi dress by ASOS DESIGN     Go with the fauxSquare neck Adjustable tie strapsRuched bodiceCaged backKick split Body-Conscious fit Figure-hugging cut ,30,ASOS DESIGN pu ruched midi dress with tie shoulder straps in stone
ASOS DESIGN,brown leopard print,Mini dress by ASOS DESIGN    Still not over animal printAll-over leopard printSpread collarVolume sleeves    Fitted cuffs    Partial button placketRegular fitTrue to size,22,ASOS DESIGN mini shirt dress in brown leopard print
ASOS Tall,black,Tall dress by ASOS DESIGN    Coming soon to your Saved ItemsPlunge halterneck Sleeveless style    Contrast stitching     Bow detail to backPeplum hem    Slim fitClose-fitting cut ,21.9,ASOS DESIGN Tall exclusive plunge halter belted pep hem midi dress with contrast top stitch in black
TFNC,pink,Dress by TFNC    Destination: dancefloor    Plunge neck    Adjustable strapsWrap front     Thigh split     Button-keyhole back    Zip-back fasteningRegular fitTrue to size,72,TFNC Bridesmaid cami wrap maxi dress with fishtail in pink
River Island,black,Dress by River Island    Coming soon to your Saved ItemsAll-over floral printCrew neckVolume sleevesFitted cuffsSide splitRegular fitTrue to size,36.15,River Island floral midi dress in black
ASOS Tall,dark purple,Tall dress by ASOS DESIGN    Act casualPlain designRound neckDrop shouldersOversized fitRelaxed and roomy,15.95,ASOS DESIGN Tall oversized t-shirt dress in dark purple
ASOS DESIGN,black/white stripe,Dress by ASOS DESIGN    Cute dressStriped designButton placketDrop shouldersBelted waistRelaxed fitLoose cut,22.4,ASOS DESIGN pinstripe dropped shoulder mini shirt dress with belt
New Look Petite,bk1 - black 1,Petite dress by New Look         Your new favorite dressPolka-dot print     Frill collar     Long sleeves    Elasticated cuffsTiered hemRegular fitTrue to size,24.2,New Look Petite poplin ruffle collar dress in black pattern
True Violet,wine,"Dress by True Violet    Dramatic entrance, sorted High neck Sleeveless style Open back Zip fastening Fishtail hem Slim fitClose-fitting cut",63.5,True Violet Black Label halterneck maxi gown with fishtail hem in wine
NaaNaa,black,Dress by NaaNaa    It’s a whole moodGlitter designHigh neckSleeveless styleRuched sidesBody-conscious fitFigure-hugging cut,22,NaaNaa high neck ruched body-conscious dress in black glitter
River Island,neutral,Dress by River Island    Très chicHigh neckFrill trimLong sleevesRegular fitTrue to size,19.6,River Island shirred yoke ruffle mini dress in beige
Parisian,black,Dress by Parisian    You choose the occasionSweetheart neckPuff sleevesRuched frontZip-side fasteningBody-Conscious fitFigure-hugging cut,32,Parisian ruched detail mini body-conscious dress in black
ASOS DESIGN,dark sage,Mini dress by ASOS DESIGN    Crack the dress codeRound neckLong sleevesRuched seam detailsOversized fitRelaxed and roomy,18,ASOS DESIGN oversized seam front detail mini dress in sage
AsYou,black,Mini dress by AsYou    As seen on the Vassallo sisters    Sweetheart neck    Cami straps    Strappy front     Body-Conscious fit     Figure-hugging cut ,13.05,AS YOU cross front mini dress in black
Accessorize,orange,Dress by Accessorize    Serving laid-back luxeV-neckPuff sleevesCinched waistRegular fitTrue to sizeExclusive to ASOS,39.2,Accessorize Exclusive puff sleeve dress in orange
Reclaimed Vintage,black,Mini dress by Reclaimed Vintage    Worn and shot by one of our models at home High neckShort sleevesRuffle detailsFloral embroideryLadder-stitch insertsButton-keyhole backRegular fitTrue to sizeExclusive to ASOS#AtHomeWithASOS,42.7,Reclaimed Vintage inspired high neck dress with lace detail and floral embroidery
Parisian,black,Dress by Parisian    Your new favorite dressOne-shoulder design     Sleeveless style    Cut-out side    Split hemSlim fitClose-fitting cut ,29,Parisian one shoulder cut out velvet dress in black
Influence,yellow,Dress by Influence    Cute dress Tie-dye printCrew neckShort sleevesRuffle cuffsTiered skirtButton-keyhole backRegular fitTrue to size,32,Influence t-shirt dress in tie dye stripe in yellow
TFNC Maternity,light gray,Maternity dress by TFNC    Destination: dancefloor V-neckPuff sleevesElasticated cuffsWrap front Tie waist Zip-back fastening Regular fit Designed to fit you from bump to baby,60,TFNC Maternity Bridesmaid wrap front maxi dress in light gray
TFNC Maternity,dusky green,Maternity dress by TFNC    Cue the group photoshootPleated design HalterneckSleeveless styleKeyhole front Thigh slit Back zip closureRegular fitDesigned to fit from bump to baby,67,TFNC Maternity Bridesmaid pleated maxi dress in dusky green
ASOS DESIGN,beige,Dress by ASOS DESIGN    This dress on repeatPlain designRound neckVolume sleevesStrappy backSmock styleRegular fitTrue to size,30.1,ASOS DESIGN linen mini smock dress with strappy back in beige
TFNC Maternity,mink,Maternity dress by TFNC    Destination: dancefloorV-neckWrap frontLong sleeves Cut-out backZip-back fasteningRegular fit    Designed to fit you from bump to baby,67,TFNC Maternity Bridesmaid wrap front maxi dress with back detail in mink
Zulu & Zephyr,white,Dress by Zulu & Zephyr    Part of our responsible editScoop neckSleeveless styleTie strapsTie sidesTiered hemRegular fitTrue to size,149.8,Zulu & Zephyr tiered maxi beach dress in white
ASOS DESIGN,mustard,Mini dress by ASOS DESIGNIn association with sunny daysBandeau neckButton detailTiered hemFrill trimRegular fitTrue to size,22.4,ASOS DESIGN bandeau tiered mini sundress in seersucker in mustard
Influence,beige,Dress by Influence    Daywear dressing 101    High neckDrop shouldersJersey yoke panel    Soft pleats to waist    Smock styleRegular fitTrue to size,32,Influence smock dress in beige
Brave Soul Plus,mink,Plus-size dress by Brave SoulLaid-back looksDrawstring hood Drop shouldersPouch pocketFitted trimsRegular fit True to size ,23,Brave Soul Plus Raku hooded sweater dress in mink
Influence,mint/black,"Dress by Influence    The perfect dress doesn't exi - All-over polka-dot print Square neck Puff sleevesElasticated cuffsShirred, stretch insertsRegular fit True to size ",22.4,Influence cotton poplin polka dot mini dress with shirring
Love & Other Things,pink,Dress by Love & Other Things    Most grammable Square neckSleeveless styleCorset-style waistZip-back fasteningBody-Conscious fitFigure-hugging cut ,38,Love & Other Things drape detail body-conscious satin midi dress in pink
TFNC Tall,navy,Tall dress by TFNC    Destination: dancefloorMultiway design     Halter neck    Sleeveless style    Zip-back fastening Regular fitTrue to size,60,TFNC Tall Bridesmaid multiway maxi dress in navy
Threadbare Curve,black,Plus-size dress by Threadbare    Laid-back looksHigh neckHalf-zip fasteningContrast panel with text printRibbed trimsRelaxed fitSlouchy cut,29,Threadbare Curve slogan half zip sweater dress in black
TFNC,navy,Dress by TFNC    Cue the group photoshootSimple styleHigh neckPleating from the waistMaxi length,64,TFNC Bridesmaid high neck pleated maxi dress in navy
Chi Chi London,mink,Dress by Chi Chi London    For that thing you RSVPd to    Bardot neck    Off-shoulder design    Sheer lace top    It's all in the details    Zip-side fastening    Fit and flare design    Regular fitTrue to size,59.25,Chi Chi London premium lace midi prom dress with bardot neck in mink
ASOS DESIGN,navy,Dress by ASOS DESIGN    Coming soon to your Saved ItemsPlunge neckRuffle sleevesLace insertsZip-back fasteningRegular fitTrue to size,31.2,ASOS DESIGN midi dress with lace godet panels
Influence,tan/black,Dress by Influence    Next stop: checkoutPolka-dot printSpread collarBib detailPuff sleevesRuffle hemRegular fitTrue to size,35,Influence frill bib shirt dress in tan polka dot
Parisian,white,Dress by Parisian    Love at first scroll     V-neck    Ruffle details     Zip-back fasteningBody-Conscious fit ,38,Parisian ruffle front body-conscious mini dress in white
Night Addict,khaki,Dress by Night Addict    Act casualCrew neckDrop shouldersSlogan to chestOversized fit,14.5,Night Addict offline oversized t-shirt dress
ASOS Petite,black,Petite dress by ASOS DESIGN    The LBD – it’s a classicHigh neckCut-out frontUnderwire cupsOpen backBody-Conscious fitHolds you close ,13.5,ASOS DESIGN Petite long sleeve underwire mini bodycon dress
ASOS Tall,pansy print,Tall dress by ASOS DESIGN    Say it with flowersCowl neckLong sleevesButton-keyhole backRegular fitA standard cut for a classic shape,15.3,ASOS DESIGN Tall long sleeve cowl shift dress in pansy print
ASOS DESIGN,blood orange,"Dress by ASOS DESIGN    For that thing you RSVPd toPlunge neckCrossover straps with ring-tab detailAsymmetric hemRegular fit No surprises, just a classic cut",32.4,ASOS DESIGN minimal midaxi dress with satin panel and tab ring detail
ASOS DESIGN,khaki,Mini dress by ASOS DESIGN    Add-to-bag potential: considerable    Square neckGold-tone bar detailBody-Conscious fitA tight cut to the body,12.75,ASOS DESIGN long sleeve textured gold bar mini dress
Missguided,multi,Dress by Missguided    Cue the party playlistCheck designPlunge neckFrill trimLong sleevesRegular fitJust select your usual size,12.6,Missguided tea dress with frill detail in plaid check
ASOS Tall,gold,Tall dress by ASOS DESIGN    Worth making plans for Gold-tone stud embellishmentCrew neckLong sleevesButton-keyhole backRegular fitJust select your usual size,33,ASOS DESIGN Tall mini shift dress with stud embellishment
Motel,gray animal,Dress by Motel    Let your outfit do the talking V-neckPuff sleevesZebra printRegular fitTrue to size ,19.55,Motel plunge neck mini dress with puff sleeve in zebra print
ASOS Curve,camel,Plus-size dress by ASOS DESIGN       Outfit of the dayCrew neckDropped shouldersOversized fitRelaxed and roomy  ,19.5,ASOS DESIGN Curve oversize mini sweat dress in camel
AX Paris,red snake,Dress by AX Paris    For your daytime thingV-neckRuched detailing to front and sleevesSnakeskin printBody-Conscious fitA tight cut to the body,15.6,AX Paris ruched front snake print midi dress
ASOS DESIGN,white,Maxi dress by ASOS DESIGN    Takes you from the ceremony to the dancefloorPlunge neckRuched bodiceZip-side fasteningRegular fitTrue to size,55.6,ASOS DESIGN Bridesmaid ruched bodice drape maxi dress with wrap waist
