brand,color,desc,retailPrice,title
ASOS DESIGN,gunmetal,Dress by ASOS DESIGN    As seen in sequins All-over embellishmentRound neck Padded shouldersLong sleevesScoop back Relaxed fitLoose cut,23.8,ASOS DESIGN long sleeve v back sequin mini dress in gunmetal
ASOS DESIGN,gray wash,Dress by ASOS DESIGN    Act casualAcid-wash designCrew neckDrop shouldersGraphic print to frontOversized fitRelaxed and roomy,12.6,ASOS DESIGN oversized long sleeve t-shirt dress with wilderness graphic in acid wash gray
Pull&Bear,multi,Mini dress by Pull&Bear    Crack the dress codeLeopard print    V-neckLong sleeves    Wrap frontZip-side fastening Regular fitTrue to size,19.85,Pull&Bear wrap mini dress in leopard print
Y.A.S,super pink,Midi dress by Y.A.S     Part of our responsible editCrew neckLong sleevesZip cuffsSide zips    Regular fitTrue to size,30,Y.A.S satin midi dress with adjustable hidden zips in pink
ASOS Curve,black,Plus-size dress by ASOS DESIGN          Crack the dress codePrairie collarHalf sleevesRegular fitTrue to size,20.8,ASOS DESIGN Curve mini tea dress with oversized prairie collar in black
Collusion,black,Dress by COLLUSION    Your new go-toPlain designRoll-neck Drop shouldersRibbed trims Relaxed fitLoose cutExclusive to ASOS,19.2,COLLUSION roll neck sweater dress in black
ASOS Maternity,navy,Maternity dress by ASOS DESIGN    For that thing you have to go to    Floral embroidery    V-neckLadder-stitch detailingLong sleevesFluted cuffsPleated skirtZip-back fasteningMidi lengthRegular fitDesigned to fit through all stages of pregnancy,42.7,ASOS DESIGN Maternity embroidered pleated midi dress with lace inserts in navy
Parisian,black,Dress by ParisianCue the party playlistCowl neckAdjustable cami strapsZip-back fasteningBody-Conscious fitFigure-hugging cut,14,Parisian velvet cami strap mini dress with cowl neck in black
Y.A.S,lemon,Mini dress by Y.A.S    Cute dress Round neckTie-up front Puff sleeves Smock style Relaxed fitLoose cut ,69,Y.A.S tie front mini smock dress in yellow
Accessorize,black,Dress by Accessorize    Crack the dress codeStripe designTie neckStatement sleevesRuffle hemRegular fitTrue to size,39.6,Accessorize statement shoulder beach dress in black
ASOS DESIGN,soft khaki,Midi dress by ASOS DESIGN     Crack the dress codeV-neck Padded shouldersThree-quarter-length sleevesWrap front Tie-side fastening Regular fitTrue to size ,42,ASOS DESIGN wrap front midi dress with shoulder pad in soft khaki
ASOS DESIGN,sage and black,Dress by ASOS DESIGN    Crack the dress code    Polka-dot printRound neckShort sleevesFrill cuffsSuper-oversized fitVery relaxed and roomy,11.2,ASOS DESIGN super oversized frill sleeve smock in sage and black spot print
ASOS Curve,mono spot,"Plus-size dress by ASOS DESIGN          Crack the dress codeAll-over spot printRound neckLong sleevesShirred, stretch bodiceRegular fitTrue to size",16.1,ASOS DESIGN Curve shirred mini smock dress in spot
In The Style Plus,stone,"Petite dress by In The Style         Collaboration with Influencer Shaughna PhillipsRuched design    Bardot neckOff-shoulder styleGathered cupsFrill sleevesShirred, stretch front     Zip-back fasteningSlim fitClose-fitting cut ",20.25,In The Style Plus x Shaughna puff sleeve shirred mini dress in stone
ASOS Curve,mono polka dot,Plus-size dress by ASOS DESIGN          Crack the dress code    Polka-dot printCrew neck    Long sleeves    Tiered skirtRegular fitTrue to size,14.4,ASOS DESIGN Curve long sleeve tiered smock midi dress in mono micro- dot
ASOS DESIGN,black,Dress by ASOS DESIGN    Serious add-to-bag potentialPlain designCrew neckDrop shouldersMesh sleevesElasticated cuffs    Relaxed fitSlouchy cut,15.95,ASOS DESIGN long sleeve mesh mix t-shirt dress in black
ASOS DESIGN,black floral,Mini dress by ASOS DESIGN    Cute dressFloral designTie neck Puff sleevesSoft pleats to waistFrill hem Smock styleRegular fitTrue to size ,22.45,ASOS DESIGN textured mini tiered smock dress in black floral
sister jane,red star,Midi dress by sister jane     The scroll is overAll-over star print    Plunge neck    Long sleeves    Button cuffsRuffle details     Asymmetric hemRegular fitTrue to size,56.4,Sister Jane midi ruffle dress with full skirt in red star print
ASOS DESIGN,bright green,Mini dress by ASOS DESIGN    Coming soon to your Saved ItemsCowl neckPadded shouldersLong sleevesRuched cuffs    Button-keyhole backRegular fitTrue to size,11.45,ASOS DESIGN cowl neck slinky long sleeve padded shoulder mini dress in bright green
Brave Soul Plus,gray heather,Plus-size dress by Brave Soul    Cute and comfyPlain designHigh neckSmock styleRegular fitTrue to size,10.8,Brave Soul Plus Lizzie high neck smock dress in gray
Miss Selfridge,black,Dress by Miss Selfridge    Our kind of flowers V-neckPuff sleevesWrap frontTie sideRegular fitTrue to size,31,Miss Selfridge wrap midi dress in black floral print
Fashionkilla Plus,gold,Plus-size dress by Fashionkilla          All dressed upRound neckLong sleevesCut-out waistThigh splitBody-Conscious fitFigure-hugging cut,18.1,Fashionkilla Plus glitter cut out long sleeve midi dress in gold
New Look Tall,red pattern,Tall dress by New Look    Cute and comfyAll-over floral printRound neckBlouson sleeves    Ruffle cuffsSmock styleRegular fitTrue to size,18,New Look Tall ruffle sleeve smock dress in burnt orange flirty floral
River Island,pink floral,Dress by River Island    Crack the dress codeFloral designV-neckLong sleevesRuched detailsZip-back fasteningRegular fitTrue to size,27.65,River Island floral ruched bust mini dress in pink
ASOS Petite,black,Petite dress by ASOS DESIGN         You choose the occasionCrew neckShort sleevesPleated skirtZip-back fasteningRegular fitTrue to size,34.4,ASOS DESIGN Petite leather look t-shirt mini skater dress in black
Fashionkilla,khaki,Dress by Fashionkilla    Serious add-to-bag potential Off-shoulder styleLong sleevesRuched frontTie detail    Regular fitTrue to size,18,Fashionkilla knitted ruched detail off-the-shoulder dress in khaki
ASOS Maternity,animal print,Maternity dress by ASOS DESIGN    You choose the occasionAnimal printHigh neckSplit sleevesBelted waistSlim fit    Designed to fit you from bump to baby,45,ASOS DESIGN Maternity satin midi tea dress with puff sleeves and belt in animal print
AsYou,dusky blue,Mini dress by AsYou    Cue the party playlistRuched design    Bandeau style     Body-Conscious fit     Figure-hugging cut Exclusive to ASOS,10.15,AS YOU slinky ruched bandeau body-conscious dress in blue
Lola May,blackwhite,Dress by Lola May    The scroll is over Check designSpread collar    Long sleeves    Button cuffs     Button placketSide splitsRegular fitTrue to size,36,Lola May midi shirt dress in black and white
New Look Plus,green pattern,"Plus-size dress by New Look          Our kind of flowers All-over floral printCrew neckVolume sleevesShirred, stretch cuffsRegular fitTrue to size",23.8,New Look Curve balloon sleeve smock dress in green pattern
Fashion Union,abstract animal,Mini dress by Fashion Union    Cute dressAll-over animal printHigh frill collarButton placketLong sleevesButton cuffsRuffle trimsRegular fitTrue to sizeExclusive to ASOS,19.85,Fashion Union high neck shirt dress with ruffle collar in abstract animal
Vero Moda,black ditsy floral,Maxi dress by Vero Moda    Crack the dress codeFloral printTie neckBalloon sleevesElasticated cuffsTiered hemRelaxed fitLoose cut ,56,Vero Moda tiered maxi dress in black floral
Lola May,black,Dress by Lola MayYour new go-toStriped design Crew neck Short sleevesFrill cuffsSoft pleats to waist Zip-back fastening Regular fitTrue to size,14.5,Lola May long smock dress in black satin stripe
ASOS Tall,oatmeal,"Tall dress by ASOS DESIGN    Your new go-toHigh neckDrop shouldersWide-cut, batwing sleevesOpen backSlim fitClose-fitting cut",18,ASOS DESIGN Tall brushed rib batwing midi dress in oatmeal
ASOS DESIGN,black,Mini dress by ASOS DESIGN    Crack the dress code    Plain designCrew neck    Puff sleevesRuffle trimsElasticated cuffs     Tiered skirtButton-keyhole backRegular fitTrue to size,15.75,ASOS DESIGN cotton poplin mini smock dress with pin tucks in black
In The Style Plus,black,Plus-size dress by In The StyleCollaboration with influencer Lorna LuxeRound neckLong sleevesPartial button frontLace insertsRegular fitTrue to size,51.2,In The Style Plus x Lorna Luxe volume sleeve button front mini smock dress in black
Influence Tall,teracotta orange,"Tall dress by Influence    Trés cuteSquare neckPuff sleevesShirred, stretch panelsTiered hemRegular fitTrue to size",32,Influence Tall puff sleeve cotton poplin mini dress in teracotta
I Saw It First,chocolate,Dress by I Saw It First     This dress deserves a night out Roll-neckSleeveless styleRacer backBody-Conscious fitFigure-hugging cut,8.4,I Saw It First racer back ribbed mini body-conscious dress in chocolate
UNIQUE21,tangerine,Dress by Unique 21    Crack the dress codeSpread collarPartial button placketShort sleevesBelted waistTiered skirtRegular fitTrue to size,48,Unique21 tiered woven shirt midi dress in tangerine
ASOS DESIGN,forest green,Mini dress by ASOS DESIGN    Can't go wrong in sweats    Fixed hoodDrop shouldersLarge tennis printRibbed trimsOversized fitRelaxed and roomy ,18,ASOS DESIGN mini hoodie sweatshirt dress with white tennis logo in forest green
Lola May,burgundy,Dress by Lola May    Cute dress Crew neck Frill sleeves Zip-back fastening Smock style Relaxed fitSlouchy cut ,18.2,Lola May smock dress in burgundy shimmer
ASOS Curve,khaki,Plus-size dress by ASOS DESIGN          Your new favorite dress    Round neck    Long sleeves    Tiered design     Smock styleRegular fitTrue to size,14.5,ASOS DESIGN Curve long sleeve tiered smock mini dress in khaki
ASOS DESIGN,teal floral print,Mini dress by ASOS DESIGN    Cute and comfyAll-over floral printRound neckThree-quarter-length sleeves    Button-keyhole backSmock styleRegular fitTrue to size,21.75,ASOS DESIGN long sleeve smock mini dress in floral dot
ASOS Maternity,forest green,Maternity dress by ASOS DESIGNCrack the dress codeJacquard chevron pattern V-neckVolume sleevesElasticated cuffsPlisse panel at bustFrill waistSmock style Regular fitDesigned to fit you from bump to baby,40,ASOS DESIGN Maternity mini babydoll smock dress in chevron jacquard in forest green
ASOS Curve,black,Plus-size dress by ASOS DESIGN          Crack the dress codeJacquard stripe patternSpread collarPartial button placketLong sleevesPleated skirtRegular fitTrue to size,21.6,ASOS DESIGN Curve pleated button through midi shirt dress in self stripe in black
ASOS Curve,leopard print,"Plus-size dress by ASOS DESIGN          The new it-dressAll-over leopard printRevere collarPlunge neckShort, puff sleeves    Elasticated cuffsThigh split    Regular fitTrue to size",19.8,ASOS DESIGN Curve ultimate midi tea dress in leopard print
ASOS DESIGN,black,Mini dress by ASOS DESIGN    Crack the dress codeCheck designHigh neck Broderie panel Long sleevesElasticated cuffsFrill detailsLadder-stitch insertsSmock styleRegular fitTrue to size,40,ASOS DESIGN mini smock dress with ruffle eyelet yoke in grid check in black
New Look Plus,black,Plus-size dress by New Look          The scroll is overPlain designSpread collarLong sleeves    Press-stud cuffsPress-stud chest pockets    Press-stud placket Tie waistRegular fitTrue to size,19.6,New Look Curve belted denim shirt dress in black
ASOS DESIGN,animal print,Mini dress by ASOS DESIGN    Cute dressAll-over animal printV-neckLong sleevesTie frontRegular fitTrue to size,11.2,ASOS DESIGN tie front mini tea dress with long sleeves in animal print
New Look Petite,br1 - brown 1,Petite dress by New Look         Cute dressAll-over dot printFrill collarLong sleevesButton-keyhole backSmock styleRelaxed fitLoose cut,22,New Look Petite poplin ruffle collar dress in brown polka dot
Flounce London,black heart print,Dress by Flounce London    Love at first scrollAll-over heart printCrew neckShort sleevesRuffle cuffsSmock style    Regular fitTrue to size,29,Flounce London smock dress with frill sleeve in heart print
Pull&Bear,multi,Mini dress by Pull&Bear    Still not over animal printAll-over leopard printV-neckBlouson sleeves    Elasticated cuffsRegular fitTrue to size,15.4,Pull&Bear long sleeve mini dress in leopard print
New Look Maternity,black,Maternity dress by New Look    Your new favorite dressCrew neckLong sleevesBody-Conscious fit    Designed to fit you from bump to baby,27.2,New Look Maternity crew neck body-conscious midi dress in black
Calvin Klein,black,Beach dress by Calvin Klein    Dreaming of the beachOpen frontCap sleevesDropped armholesDrawstring waistRelaxed fitLoose cut ,61,CK Swim st tropez tie front beach maxi dress in black
Missguided,black,"Dress by Missguided    Crack the dress codeAll-over floral printSquare neckShirred, stretch bustLong sleevesRegular fitTrue to size",33.6,Missguided milkmaid mini dress with shirred bust in black ditsy
ASOS DESIGN,rose,Dress by ASOS DESIGN    You choose the occasionPleated designPlunge neckSleeveless styleRope detailRegular fitTrue to size,33.2,ASOS DESIGN belted pleated tulle cami midi dress in rose
ASOS Petite,forest green,Petite dress by ASOS DESIGN         Cute dressHigh neckPartial button placketLong sleevesRegular fitTrue to size,25.6,ASOS DESIGN Petite long sleeve button-front mini smock dress in green
Fashionkilla Plus,berry,Plus-size dress by Fashionkilla          Crack the dress codeFallen-shoulder styleBatwing sleevesWrap front Adjustable tie waist Slim fitClose-fitting cut,15.75,Fashionkilla Plus knitted off shoulder tie detail mini dress in chocolate
Parisian,red/pink,Dress by Parisian    The scroll is overAll-over floral print Bardot neck Off-shoulder designElasticized blouson sleevesNotch front Zip-back fastening Slim fit,23.2,Parisian bardot notch front mini dress in floral print
ASOS DESIGN,wine,Tall dress by ASOS DESIGN    Coming soon to your IG feedStrappy designPlunge neckDouble-cup detailBody-Conscious fitFigure-hugging cut,20.8,ASOS DESIGN Tall rib double cup strappy cami midi dress in wine
ASOS DESIGN,black,Mini dress by ASOS DESIGN    Cue the party playlistHigh neck Shoulder pads Volume sleeves Fitted cuffs Contrast skirt     Button-keyhole back    Zip-back fasteningSlim fitClose-fitting cut ,26.45,ASOS DESIGN croc pu shoulder pad drape mini dress in black
ASOS DESIGN,mono,Dress by ASOS DESIGN    You choose the occasionSpot printSweetheart neckRuched sleevesLace-up backBody-Conscious fitFigure-hugging cut,18.9,ASOS DESIGN ruched shirred cuff with strappy back mini dress in mono spot
Missguided Plus,black,Plus-size dress by Missguided          Crack the dress codeAll-over spot printV-neckPartial button frontLong sleevesTie waistRegular fitTrue to size,14.7,Missguided Plus tea dress with long sleeves in black dalmatian
Flounce London Plus,black,Plus-size dress by Flounce London          The scroll is over Crew neckLong sleevesRelaxed fitLoose cut ,10.2,Flounce London Plus basic high neck t-shirt dress in black
ASOS DESIGN,pine green,"Mini dress by ASOS DESIGN    Looks cute, feels comfyFrill collarButton placketVolume sleevesElasticated cuffsSide pocketsRegular fitTrue to size",12.6,ASOS DESIGN mini dress with lace trim collar in green
The Couture Club,black,Mini dress by The Couture Club     Serious add-to-bag potential     Crew neck    Drop shoulders     Logo embroideryLarge print to reverse    Oversized fitRelaxed and roomy,48,The Couture Club oversized t-shirt dress with graphic print in black
ASOS DESIGN,mustard,Mini dress by ASOS DESIGN    Your new favorite dressHigh neck    Puff sleeves    Elasticated cuffs    Belted waist    Peplum hemLace-up backRegular fitTrue to size,63.2,ASOS DESIGN broderie puff sleeve mini dress with pephem and eyelet back in mustard
Missguided Plus,stone,"Plus-size dress by Missguided          Crack the dress codeSpread collarButton placketBlouson sleevesButton cuffsShirred, stretch waist    Regular fit True to size Exclusive to ASOS",21.6,Missguided Plus mini shirt dress with shirred panel in stone
Brave Soul Plus,grey,Plus-size dress by Brave Soul         Make some legroomPlain designCrew neckLong sleevesRegular fitTrue to size,10.2,Brave Soul Plus lana lounge t-shirt dress in gray
ASOS Curve,black/white stripe,"Plus-size dress by ASOS DESIGN          Comfy, meet coolStriped designCrew neckDrop shouldersOversized fitRelaxed and roomy",25.6,ASOS DESIGN Curve oversized t-shirt dress with long sleeve in black and white stripe
AX Paris,brushstroke,Dress by AX Paris    Easily dressed up or downWrap styleAll-over printThigh slitRegular fit,51,AX Paris plunge wrap dress in brushstroke
ASOS DESIGN,mono check,"Dress by ASOS DESIGN    Crack the dress codeCheck designSpread collarRaglan sleeves    Button cuffs     Button-through front Side splitsDropped hemBoyfriend fitSlouchy, relaxed cut",16.2,ASOS DESIGN oversized boyfriend mini shirt dress in mono check
ASOS Tall,camel floral,Tall dress by ASOS DESIGN    Cute dressFloral printCrew neckBatwing sleevesGathered detailingElasticated waistRegular fitTrue to size,18.4,ASOS DESIGN Tall textured smock dress with gathered neck and waist seam in camel floral
ASOS DESIGN,forest green,Midi dress by ASOS DESIGN     Who doesn’t love playing dress-up?Plunge neckPuff sleeves Belted waistSkater style Zip-side fastening    Regular fit True to size ,29.05,ASOS DESIGN plunge belted skater midi prom dress in forest green
New Girl Order,black,Dress by New Girl OrderComing soon to your Saved ItemsV-neckSpread collarDrop shouldersLong sleevesButton-through frontOversized fitRelaxed and roomy,28,New Girl Order oversized linen look shirt dress in black
Missguided,pink,Dress by Missguided    Still not over animal print High neckBlouson sleevesButton cuffsFrill trimsSmock styleRelaxed fitLoose cut,32,Missguided long sleeve smock dress with frill shoulder in pink
Love & Other Things,off white,Dress by Love & Other Things    The scroll is over    Square neck    Ruched front     Zip-back fasteningRegular fit ,38,Love & Other Things satin ruched front slit body-conscious dress in off white
ASOS DESIGN,hot pink,Mini dress by ASOS DESIGN    Crack the dress codeSpread collarButton placketPadded shouldersLong sleevesButton cuffsElasticated waist Regular fit True to size ,20.4,ASOS DESIGN button-down mini shirt dress with shoulder pads in satin in hot pink
Night Addict,washed black,Dress by Night Addict    Act casualAcid-wash designCrew neckDrop shouldersText print to chestLogo print to backOversized fitRelaxed and roomy,19,Night Addict family oversized t-shirt dress in washed black
ASOS Curve,black/orange floral,Plus-size dress by ASOS DESIGN          Crack the dress codeAll-over floral printRound neckShort sleevesSmock styleRelaxed fitLoose cut,20.2,ASOS DESIGN Curve plisse mini smock dress with dip hem in black and orange floral print
ASOS DESIGN,animal print,Mini dress by ASOS DESIGN    Cute dressAnimal printCrew neckLong sleevesSmock styleRegular fitTrue to size,10.15,ASOS DESIGN long sleeve tiered smock midi dress in animal print
ASOS Curve,white,Plus-size dress by ASOS DESIGN    Dress for the weather you want Scoop neckPartial button placketTie shoulder strapsCrochet trimsSmock styleRegular fitTrue to size,32,ASOS DESIGN Curve tie shoulder lace insert smock mini sundress in white
ASOS DESIGN,black/pink floral,Mini dress by ASOS DESIGN    The new it-dressAll-over floral printV-neckButton detail to frontLong sleevesStretch cuffsRegular fitTrue to size,16,ASOS DESIGN button through tea dress in black and pink floral
ASOS DESIGN,maroon,Midi dress by ASOS DESIGN     All dressed upRuched designV-neckOff-shoulder styleLong sleevesSash front detailBody-Conscious fitFigure-hugging cut,16,ASOS DESIGN bardot long sleeve midi dress with sash detail in maroon
ASOS DESIGN,khaki/black stripe,Mini dress by ASOS DESIGN    Cute dressHorizontal stripe designV-neckVolume sleevesWrap frontSmock styleOversized fitRelaxed and roomy,17.5,ASOS DESIGN casual oversized mini smock dress in khaki black stripe
ASOS Petite,black,Petite dress by ASOS DESIGNWorn and shot by one of our models at home Plain designFixed hoodDrop shouldersFitted trims Relaxed fitSlouchy cut#AtHomeWithASOS,10.4,ASOS DESIGN Petite oversized hoodie sweat dress in Black
TFNC,pink,"Dress by TFNC    For ultimate squad goalsFully linedPleated finishV-neckSleeveless styleHigh splitCut-out design to reverseZip back with hook-and-eye fasteningTextured finishRegular fitNo surprises, just a classic cut",45.1,TFNC bridesmaid exclusive pleated maxi dress with back detail in pink
Influence,lilac,Dress by InfluenceTrés cuteRound neckShort sleevesRuffle cuffsRuched waistOpen back with button neckTie backRegular fitTrue to size,44,Influence cotton poplin open back midi dress in lilac
ASOS DESIGN,red/white spot,Mini dress by ASOS DESIGN    The new it-dressPolka-dot printSweetheart neck    Puff sleevesRuched cuffsFaux-button placketZip-back fasteningRegular fitTrue to size,21,ASOS DESIGN cotton babydoll mini dress in polka dot
In The Style,rust,Dress by In The Style    This dress deserves a night out2-in-1 styleSequin-embellished designHigh neckLong sleevesOpen backRuched detailsBody-Conscious fitFigure-hugging cutExclusive to ASOS,27.45,In The Style exclusive sequin high neck 2 in 1 mini dress in rust
New Look Tall,black pattern,"Tall dress by New Look    Your new favorite dress    All-over floral print     V-neckLong sleeves    Shirred, stretch cuffs     Wrap frontTie side    Regular fitTrue to size",18,New Look Tall belted tea dress in floral print
ASOS DESIGN,mono spot,Dress by ASOS DESIGN    Crack the dress codePolka-dot designV-neckThree-quarter-length sleevesTiered hemRegular fitTrue to size,27.5,ASOS DESIGN wrap front mini dress with pleated tiered skirt in mono spot
ASOS Curve,black,"Plus-size dress by ASOS DESIGN          Crack the dress codeSpread collar    Long sleeves    Button cuffs     Button-through frontBoyfriend fitSlouchy, relaxed cut",25.2,ASOS DESIGN Curve oversized boyfriend mini shirt dress in black
In The Style,gray multi,"Dress by In The Style    Collaboration with influencer Lorna LuxeTie neckLong sleevesFluted cuffsShirred, stretch panelsTiered hemSlim fitClose-fitting cut ",26,In The Style x Lorna Luxe lace high neck tie detail smock dress in white floral
Lola May,khaki/white,Dress by Lola May    Your new go-toStripe designSpread collarButton placketRaglan volume sleevesButton cuffsDipped hemRelaxed fitLoose cut,32,Lola May oversized dip hem stripe shirt dress in khaki
ASOS DESIGN,green based floral,Mini dress by ASOS DESIGN    Cute dressAll-over floral printHigh frill neckPartial button placketLong sleevesSmock styleRegular fitTrue to size,22.4,ASOS DESIGN long sleeve button front mini smock dress in floral print
New Look Tall,black,Tall dress by New Look    Your new go-toCrew neck Three-quarter-length sleevesTie waist Slim fitClose-fitting cut,17.6,New Look Tall 3/4 sleeve ribbed tie front midi dress in black
ASOS Curve,black,Plus-size dress by ASOS DESIGN       Add-to-bag potential: considerable Crew neckDropped shouldersLong sleevesFitted cuffs and hemOversized fitDesigned to look baggy ,21.75,ASOS DESIGN Curve oversized sweat dress in black
Lavish Alice,black,"Mini dress by Lavish Alice    Coming soon to your IG feedOff-shoulder designShirred, stretch shouldersSheer volume sleevesFaux-button detailWrap skirtAsymmetric hemZip-back fasteningBody-Conscious fitFigure-hugging cut",57.15,Lavish Alice off-the-shoulder sheer volume sleeve mini wrap detail tux dress in black
ASOS DESIGN,khaki animal print,Mini dress by ASOS DESIGN    The scroll is overAll-over animal print V-neckLong sleevesElasticated cuffs Button-through frontPeplum hem Regular fitTrue to size,19.35,ASOS DESIGN button front smock dress in khaki animal print
ASOS Curve,taupe,"Plus-size dress by ASOS DESIGN          If in doubt, knitwearV-neckWrap frontDrop shouldersRelaxed fitLoose cut",32,ASOS DESIGN Curve super soft long sleeve rib mini wrap dress in taupe
Outrageous Fortune,black,"Mini dress by Outrageous Fortune    Like what you see, do ya?Plunge neckFluted sleevesWrap frontTie waistRuffle trimRegular fitJust select your usual size",13.05,Outrageous Fortune ruffle wrap dress with fluted sleeve in black
ASOS DESIGN,leopard print,Midi dress by ASOS DESIGN    Your new go-to All-over animal print High neck Long sleevesRegular fitTrue to size,22,ASOS DESIGN midi T-shirt dress in animal jacquard
ASOS DESIGN,blue floral,"Mini dress by ASOS DESIGN    Cute dressAll-over floral printContrast, ruffle collarV-neckThree-quarter-length sleevesSlim fitClose-fitting cut",16.1,ASOS DESIGN mini tea dress with extreme contrast collar in velvet black and blue floral print
New Look Petite,multi,Petite dress by New Look         Your new favorite dressAll-over leopard printRound neckLong sleevesRuffle cuffsSmock styleRegular fitTrue to size,22.5,New Look Petite ruffle cuff mini smock in pale pink animal print
Parisian,black,Dress by Parisian    This dress deserves a night outSquare cowl neckAdjustable cami strapsZip-back fasteningKick splitBody-Conscious fitFigure-hugging cut,15.65,Parisian velvet cami strap midi dress with cowl front in black
ASOS DESIGN,animal print,Mini dress by ASOS DESIGN    Coming soon to your Saved ItemsLeopard printSpread collarV-neckBlouson sleevesButton cuffsPeplum hemRegular fitTrue to size,14.4,ASOS DESIGN trapeze mini shirt dress with peplum hem in animal print
River Island Plus,black,Plus-size dress by River Island          Serious add-to-bag potential     Crew neck    Drop shoulders    Slogan printRelaxed fitSlouchy cut,17.4,River Island Plus good things slogan mini T-shirt dress in black
Missguided,multi,Dress by Missguided    For your daytime thingLined designFloral print    Stand collar with tie detailV-neckRaglan sleevesFront slitMidi lengthRegular fitJust select your usual size,19.6,Missguided tie front keyhole midi dress in floral
