brand,color,desc,retailPrice,title
Y.A.S,floral multi,Dress by Y.A.S    The scroll is overFloral print     V-neck    Short sleeves    Regular fitTrue to size,48.3,Y.A.S v-neck floral mini dress in multi
Love Moschino,pink,Dress by Love Moschino    Act casualRound neckShort sleevesBranded designRibbed trimsRegular fitTrue to size,239,Love Moschino doll print sweater dress in pink
Love Moschino,leopard/green,Dress by Love Moschino    Crack the dress codeAnimal printSquare neckSleeveless styleBody-Conscious fit Figure-hugging cut ,159,Love Moschino bright leopard body-conscious mini dress in green
ASOS Curve,sage green,Plus-size dress by ASOS DESIGN          Cute and comfyPlain designRoll-neckDrop shouldersFitted cuffsSeam detail to reverseRegular fitTrue to size,18,ASOS DESIGN Curve super soft long sleeve roll neck mini dress in sage green heather
Miss Selfridge,pink,Mini dress by Miss Selfridge    Cute dressAll-over ribbed designSquare neckLong sleevesSlim fitClose-fitting cut,10.15,Miss Selfridge square scoop neck mini dress in pink
ASOS Curve,zebra print,Plus-size dress by ASOS DESIGN          Still not over animal printZebra printRoll-neckDrop shouldersFitted cuffsRelaxed fitSlouchy cut,20.7,ASOS DESIGN Curve super soft long sleeve roll neck mini dress in zebra print
Monki,beige,Midi dress by Monki      Crack the dress codePlain designCrew neck    Drop shouldersPuff sleeves    Fitted cuffs Relaxed fitSlouchy cut,22.4,Monki Tina puff sleeve knitted midi dress in beige
Miss Selfridge,oatmeal,"Mini dress by Miss Selfridge    If in doubt, knitwearRibbed designV-neckLong sleevesTie backRegular fitTrue to size",15.75,Miss Selfridge tie back knitted dress in oatmeal
ASOS Tall,charcoal gray,"Tall dress by ASOS DESIGN    Comfy, meet cool Roll-neck     Balloon sleeves    Fitted cuffsRelaxed fitLoose cut ",16,ASOS DESIGN Tall super soft long sleeve roll neck mini dress in charcoal gray heather
ASOS DESIGN,oxblood,Mini dress by ASOS DESIGN    Act casualCrew neckBatwing sleevesTie waistRegular fitTrue to size,14,ASOS DESIGN tie waist brushed rib mini dress in oxblood
NaaNaa,black,Dress by NaaNaa    Your new favorite dress    High neck    Zip front    Long sleevesBody-Conscious fit Figure-hugging cut ,22.5,NaaNaa ribbed zip front sporty body-conscious dress in black
New Look,green,Dress by New Look    Crack the dress codeRound neckLong sleevesFrill trimTiered hemRegular fitTrue to size,13.65,New Look ruffle detail smock mini dress in green
Missguided,black,"Mini dress by Missguided    Cute dressFloral design All-over metallic stripesCrew neck Volume sleevesButton cuffsShirred, stretch waistButton-keyhole back Tiered skirtRegular fitTrue to sizeExclusive to ASOS",22.95,Missguided mini dress with shirred waist in black floral
River Island,black,Mini dress by River Island    Serious add-to-bag potential Crew neck Drop shouldersVolume sleevesRibbed cuffsLeopard print skirtRelaxed fitSlouchy cut,24.5,River Island leopard mix mini sweater dress in black
ASOS DESIGN,camel,Mini dress by ASOS DESIGN    Crack the dress codeSpread collarPartial button placketBalloon sleevesOversized fitRelaxed and roomy,17.85,ASOS DESIGN cord oversized shirt dress with balloon sleeve in camel
Missguided,stone,Mini dress by Missguided    Crack the dress codeAll-over leopard printHigh neckLong sleevesStretch cuffsRelaxed fitSlouchy cut,14.7,Missguided shift dress with high neck in stone leopard
Yaura,navy,Maxi dress by Yaura    All dressed upHalterneck styleCrossover detailCut-out front and backThigh splitZip-back fastening Slim fitClose-fitting cut ,35.9,Yaura high neck halter maxi dress in navy
ASOS DESIGN,zebra print,Dress by ASOS DESIGN    Crack the dress codeZebra designRoll-neckLong sleevesFitted cuffsRelaxed fitSlouchy cut ,16.1,ASOS DESIGN super soft long sleeve roll neck mini dress in zebra print
New Look,black,Dress by New Look    You choose the occasionTie neckLong sleevesButton cuffsCut-out detailRuffle trimRegular fitTrue to size,13.65,New Look tie neck ruffle detail mini dress in black
ASOS Petite,burgundy marl,Petite dress by ASOS DESIGN         Cute and comfyMarl designRoll-neckDrop shouldersFitted cuffsSeam detail to reverseRegular fitTrue to size,16,ASOS DESIGN Petite super soft long sleeve roll neck mini dress in burgundy heather
Wednesday's Girl Curve,mid wash denim,Plus-size dress by Wednesday's Girl          Your new favorite dressSpread collarButton placketLong sleevesButton cuffs    Tie waistRegular fitTrue to sizeExclusive to ASOS,27.2,Wednesday's Girl Curve belted mini dress in denim
Liquorish,animal print,Dress by Liquorish    Crack the dress codeAll-over animal printV-neck    Wide-cut sleevesWrap front    Tie waistRegular fitTrue to size,44.8,Liquorish midi wrap dress in blue animal print
Forever U,black,Mini dress by Forever Unique    Ring light at the readyPeak lapelsPuff sleevesDouble-breasted styleButton fasteningBelted waistPocket detailsRegular fitTrue to size,76,Forever U puff sleeve blazer dress with belt in black
UNIQUE21,black,Dress by Unique 21    Big looksSweetheart neckPuff sleevesBow front with cut-out detailZip-back fasteningTiered hemRegular fitTrue to size,24,Unique21 twist front dress
Weekday,black,Mini dress by Weekday    Shot by one of our stylists at home Part of our responsible edit     Crew neck    Drop shoulders    Slogan print to chest     Relaxed fitSlouchy cut#AtHomeWithASOS,22,Weekday Tracy double layer T-shirt dress with slogan in black
Talulah,daisy crochet pink,Dress by Talulah    Our kind of flowersAll-over floral cut-out design Round neckLong sleevesZip-back fastening Regular fit True to size ,195,Talulah Lady of Luxury mini dress in red
Criminal Damage,black,Dress by Criminal Damage    Can't go wrong in sweatsDrawstring hoodOverhead designDrop shouldersRhinestone logo to chestPouch pocketFitted trimsOversized fitRelaxed and roomy,22.5,Criminal Damage oversizeed hoodie dress with rhinestone embellished logo in black
River Island,pink,Mini dress by River IslandWorn and shot by one of our models at home High neck Cut-out to shoulderFaux-pearl buckle detail Long sleevesRibbed trims Relaxed fitSlouchy cut#AtHomeWithASOS,29.2,River Island cut out mini sweatshirt dress in pink
Femme Luxe,stone,Dress by Femme Luxe    You choose the occasionSquare neckSleeveless styleRuched panelsBody-Conscious fitFigure-hugging cut,15.75,Femme Luxe ruched mini dress in stone
Little Mistress,coral,"Dress by Little MistressDestination: dancefloorRound neckBead and faux-pearl yoke embellishment Sleeveless stylePleated bust Cross-over waist Shirred, stretch back panel Regular fitTrue to size",46,Little Mistress Bridesmaid chiffon maxi dress with pearl embellishment in coral
In The Style,multi,Dress by In The Style    Collaboration with influencer Olivia BowenChecked designSpread collarButton placketDrop shouldersButton cuffs    Tie waistCut longer than standard lengthRegular fitTrue to size,21,In The Style x Olivia Bowen longline shirt dress with belt detail in plaid
Jovani,champagne,Dress by Jovani    All dressed up Sequined embellishmentPlunge neckSleeveless styleMesh insertsLow backZip-back fasteningRegular fitTrue to size,182,Jovani notch neck bandeau maxi dress in pink
Pieces,light gray marl,Dress by PIECES    Crack the dress codeV-neckLong sleevesDeep cuffsRibbed trimsRegular fitTrue to size,16.8,Pieces wool mix sweater dress with deep cuffs and v neck in gray
Little Mistress,mink,"Dress by Little Mistress    Cue the group photoshootFaux-pearl and rhinestone embellishmentRound neckSleeveless styleGathered waistShirred, stretch backRegular fitTrue to size",49.65,Little Mistress Bridesmaid chiffon maxi dress with pearl embellishment in mink
Liquorish,red floral,Dress by Liquorish    Cute dressAll-over floral printV-neckShort sleevesRegular fitTrue to size,57,Liquorish mini dress in red floral
ASOS Curve,oatmeal,Plus-size dress by ASOS DESIGN          Crack the dress codePlain designHigh cowl neckWide-cut batwing sleevesRegular fitTrue to size,16.2,ASOS DESIGN Curve brushed rib batwing mini dress in oatmeal
Object,black,Midi dress by Object     Part of our responsible editRound neckPadded shouldersSleeveless styleSide splitsRegular fitTrue to size,33.6,Object midi dress with padded shoulder in black
Tommy Jeans,grey,Dress by Tommy Hilfiger    Act casualCrew neck Sleeveless styleLogo embroidery to chestRibbed hemRegular fitTrue to size,28.9,Tommy Jeans logo sleeveless dress in gray
Talulah,red lace,Midi dress by Talulah     It’s a whole moodV-neckSleeveless styleAdjustable strapsZip-back fasteningSide slitSlim fitClose-fitting cut ,185,Tallulah Rouge Lure Midi Dress
Little Mistress,lavender gray,"Dress by Little MistressDestination: dancefloorRound neckBead and faux-pearl yoke embellishment Sleeveless stylePleated bust Cross-over waist Shirred, stretch back panel Regular fitTrue to size",46,Little Mistress Bridesmaid chiffon maxi dress with pearl embellishment in lavender gray
M Lounge,chocolate,Beach dress by M Lounge    For temperamental tempsPlain designCrew neckDrop shouldersBalloon sleeves Fitted cuffsRibbed trimsRelaxed fitLoose cut,19.95,M Lounge relaxed knitted sweater dress
Oasis,black,Dress by Oasis    The scroll is over     High neck    Long sleeves    Elasticated cuffsRuffle trim Tie waist     Regular fitTrue to size,56,Oasis eyelet bib skater dress in black
TFNC,black,Dress by TFNC    The scroll is over     High neck    Sleeveless style    Lace insertFrill details     Smock styleRegular fitTrue to size,38,TFNC high neck pleated smock mini dress in black
ASOS Curve,forest green,Plus-size dress by ASOS DESIGN          Coming soon to your Saved ItemsCrew neckDrop shouldersRibbed cuffsPeplum hemOversized fitRelaxed and roomy ,12.8,ASOS DESIGN Curve oversized sweatshirt dress with pep hem in forest green
ASOS Petite,cream,Petite dress by ASOS DESIGN         Keeping it cozyPlain designFixed hoodDrop shouldersRibbed trimsRelaxed fitSlouchy cut,18.4,ASOS DESIGN Petite mini dress with hoodie in cream
Bershka,beige,Dress by Bershka    Act casualPlain designHigh neckDrop shouldersRibbed cuffsRelaxed fitSlouchy cut,15,Bershka high neck sweat dress in beige
Ghost,black print,Midi dress by Ghost     The scroll is over All-over floral print     V-neck    Long sleeves    Regular fitTrue to size,71.4,Ghost Kacey satin dress in black floral print
ASOS DESIGN,animal print,Midi dress by ASOS DESIGN     The scroll is over     All-over animal print     High neck    Long sleeves    Regular fitTrue to size,16.1,ASOS DESIGN mesh midi dress in animal print
ASOS DESIGN,camel,Mini dress by ASOS DESIGN    Act casualSpread collarPartial zip fasteningDrop shouldersContrast sleeve panelsRibbed trimsRelaxed fitSlouchy cut ,13.8,ASOS DESIGN mini dress with zip collar detail in color block in camel
Love Moschino,black,Dress by Love Moschino    Coming soon to your Saved ItemsCrew neckLong sleevesRhinestone-embellished logoRegular fit True to size,146,Love Moschino diamante logo dress in black
TFNC,blush,Dress by TFNC    Cue the group photoshootPleated designHalterneckSleeveless styleFitted waistZip-back fasteningRegular fitTrue to size,54,TFNC Bridesmaid halterneck pleated maxi dress in blush
Guess,black,Dress by Guess    Go with the fauxSpread collarPress-stud placketLong sleevesChest pocketsTie waistSlim fitClose-fitting cut ,89.6,Guess long sleeve shirt dress with padded shoulders in black
Ghost,black,Dress by Ghost    Crack the dress codeSpread collarPartial button placketLong sleevesButton cuffsPleat detailsFront split Regular fit True to size ,164.45,Ghost Claudette dress with long sleeves and side split in black
NaaNaa,black,Dress by NaaNaa    Doing it for the glam    Ruched design    Square neck    Puff sleeves    Elasticated cuffs    Zip-back fastening    Slim fit    Close-fitting cuts,45,NaaNaa square neck ruched satin dress in black
ASOS Curve,green floral,Plus-size dress by ASOS DESIGN          Cute dressFloral designV-neckRuffle overlayLong sleevesElasticated cuffsSmock styleRegular fitTrue to size,16,ASOS DESIGN Curve long sleeve v-neck dress with tie neck detail in forest green and pink floral
ASOS Curve,khaki,Plus-size dress by ASOS DESIGNTurn up the texture Crew neck Drop shouldersFront pockets Oversized fitRelaxed and roomy,18.4,ASOS DESIGN Curve oversized suedette T-shirt dress with pocket detail in khaki
Mango,cream,"Dress by Mango    If in doubt, knitwearV-neckVolume sleevesRibbed trims    Regular fitTrue to size",48,Mango knitted sweater dress in ecru
ASOS Maternity,black,Maternity dress by ASOS DESIGN    You choose the occasionV-neckLong sleevesFloral embroideryWrap frontTie waistRegular fit    Designed to fit you from bump to baby,25.3,ASOS DESIGN Maternity wrap long sleeve midi dress in black with blue floral embroidery
Derek Lam 10 Crosby,midnight,Dress by Derek Lam 10 Crosby    Serious add-to-bag potential Slash neck Button placket Chest pocket Contrast stitching Long sleeves Button cuffs Cinched waist Side pockets Relaxed fitLoose cut ,125,Derek Lam 10 Crosby asymmetric contrast stitch mini dress in blue
Queen Bee,navy,Maternity dress by Queen Bee    The scroll is overV-neckBatwing sleevesWrap frontTie waistKick splitBody-Conscious fit    Designed to fit you from bump to baby,30,Queen Bee Maternity long sleeve body-conscious dress in navy
Lost Ink,indigo,Mini dress by Lost Ink.    Your new favorite dressPanelled designSpread collarButton placketGathered shouldersRaglan sleeves    Button cuffs    Slim fitClose-fitting cut,21.9,Lost Ink denim dress in vintage wash with gathered shoulders
ASOS DESIGN,black,Mini dress by ASOS DESIGN    The scroll is over    High neck    Cut-out detailLong sleeves    Corset-style waist     Hook-and-eye front    Zip-back fasteningSlim fitClose-fitting cut ,22.5,ASOS DESIGN peekaboo corset mini dress in black
ASOS DESIGN,black,Dress by ASOS DESIGN    Act casualCrew neckSleeveless stylePadded shouldersSlogan printRegular fitTrue to size,11.2,ASOS DESIGN padded shoulder sleeveless T-shirt dress with maybe never print in black
Stradivarius,tan,Dress by Stradivarius    Throw-on appealPlain designPoint collarButton placketLong sleevesButton cuffsDipped hemRelaxed fitLoose cut,32.2,Stradivarius cord shirt dress in tan
New Look Tall,light gray,Tall dress by New Look    Crack the dress codeCrew neckLong sleevesDropped ruffle hemSlim fitClose-fitting cut ,11.2,New Look Tall drop hem sweatshirt dress in light gray
Flounce London Maternity,navy,Maternity dress by Flounce London    You choose the occasionRound neckLong sleevesBody-Conscious fit    Designed to fit you from bump to baby,32,Flounce Maternity button trim ribbed midi dress in navy
Love Moschino,violet,Dress by Love Moschino    Next stop: checkoutCrew neckShort sleevesGraphic print to frontRegular fitTrue to size,126,Love Moschino Buns of Steel t-shirt dress in violet
Mango,grey,Dress by Mango    Your new favorite dressHigh neck Drop shoulders Relaxed fitSlouchy cut ,27.2,Mango high neck jersey dress in charcoal
ASOS Tall,neutral animal print,Midi dress by ASOS DESIGN     Crack the dress codeAll-over animal printV-neckLong sleevesWrap frontBelted waistTiered hemRegular fitTrue to size,24.3,ASOS DESIGN Tall midi plisse wrap long sleeve belted dress in neutral animal print
New Look Tall,camel,Tall dress by New Look    Your new go-toSpread collarV-neck Long sleevesSlim fitClose-fitting cut,16,New Look Tall polo collar ribbed dress in camel
Miss Selfridge Petite,black,Petite dress by Miss Selfridge         Coming soon to your Saved ItemsCrew neckLong sleevesFrill detailsRegular fitTrue to size,16.8,Miss Selfridge Petite frill sleeve sweatshirt dress in black
Monki,beige,Sweater by Monki     Part of our responsible editPlain designHigh neckDrop shouldersRelaxed fitSlouchy cut,22.4,Monki Lo recycled polyester sweater dress in beige
Liquorish,black,Dress by Liquorish    Crack the dress codePlain design     High neck    Puff sleeves    Fitted cuffs     Tie waistRegular fitTrue to size,31.5,Liquorish knitted mini dress with tie detail in black
Noisy May,charcoal,Dress by Noisy May    Part of our responsible edit     High neck     Partial press-stud placket     Dropped shoulders     Ribbed trims Relaxed fitSlouchy cut ,24.75,Noisy May rugby dress with high neck in charcoal
JDY,spot,"Mini dress by JDY    Looks cute, feels comfyPolka-dot design V-neckLong sleevesElasticated cuffsTiered skirtSmock style Regular fitTrue to size",16.8,JDY woven mini dress in dot print
Reclaimed Vintage,mono check,"Midi dress by Reclaimed Vintage Inspired     Crack the dress codeAll-over check designSquare neckButton placketVolume sleevesFitted cuffsShirred, stretch backRegular fitTrue to sizeExclusive to ASOS",15.3,Reclaimed Vintage Inspired button front volume sleeve midi dress in check
ASOS Curve,black,Plus-size dress by ASOS DESIGN          Laid-back looks Drawstring hoodOverhead designCherry chest and back print 'Ripe and Juicy' sloganFitted trimsRegular fit True to size ,30,ASOS DESIGN Curve mini sweatshirt hoodie dress in black with cherry sweet logo
Whistles,champagne,Mini dress by Whistles    Doing it for the glamSequinned embellishmentRound neckShort sleevesButton-keyhole backZip-back fasteningShift styleRegular fitTrue to size,89.6,Whistles sequin shift dress in champagne
Love Moschino,mel.light gray,Dress by Love Moschino    Laid-back looks    Drawstring hood     Short sleeves    Elasticated waistSide pockets     Branded patchRegular fitTrue to size,186,Love Moschino boxing logo hooded short sleeve dress in gray
Love Moschino,black,Dress by Love Moschino    Love at first scrollCrew neckDrop shouldersBranded print to frontSide pocketsRelaxed fitSlouchy cut,166,Love Moschino circle logo short sleeve dress in black
Love Moschino,pitone f.grigio,Dress by Love Moschino    Add-to-bag material All-over heart print     Crew neck    Long sleeves    Logo detail to chestSlim fitClose-fitting cut ,179,Love Moschino multi heart print dress in gray
Pieces,sea turtle,Dress by PIECES    Act casualPlain designHigh neckLong sleevesRibbed trimsRegular fitTrue to size,20,Pieces high neck knitted dress in khaki
Little Mistress,cornflower,Dress by Little Mistress    Takes you from the ceremony to the dancefloorRound neckFaux-pearl embellishment Sleeveless style Elasticated waistband Button-keyhole backRegular fitTrue to size,43.2,Little Mistress bridesmaid satin maxi dress with embellishment in cornflower
Closet London,black,"Mini dress by Closet    Simple, meet stylishStripe design Crew neck Cropped sleevesPull-on styleRegular fit True to size ",29.05,Closet London off shoulder cropped sleeve wrap mini dress in black
ASOS Curve,animal print,Plus-size dress by ASOS DESIGN          Crack the dress codeAll-over animal printV-neckBlouson sleevesTie frontSmock styleRelaxed fitSlouchy cut,19.35,ASOS DESIGN Curve mini smock dress with long sleeves and tie neck detail in animal print
ASOS DESIGN,taupe,"Midi dress by ASOS DESIGN     Cozy, meet chicHigh neck Ribbed bell sleevesSide splits Ribbed trims Body-Conscious fit Figure-hugging cut ",15.3,ASOS DESIGN knit dress with bell sleeve detail in taupe
TFNC,mink,Dress by TFNC    Destination: dancefloorRound neckSleeveless stylePleated bodyCinched waistZip-back fasteningRegular fitTrue to size,72,TFNC Bridesmaid pleated maxi dress in mink
Only,black,Dress by Only    For temperamental tempsPlain designRoll-neckDrop shouldersRibbed trimsRegular fitTrue to size,17.5,Only long sleeve roll neck sweater dress
TFNC Tall,pink,Tall dress by TFNC    Destination: dancefloor    V-neck    Adjustable strapsDrape detailThigh split     Button-keyhole backRegular fitTrue to size,64,TFNC Tall Bridesmaid cami wrap maxi dress with fishtail in pink
JDY,black w flowers,Mini dress by JDY    Our kind of flowersAll-over floral printV-neckThree-quarter-length sleevesElasticated cuffsDropped waistRegular fitTrue to size,15.75,JDY floral mini dress in black
Only,pink,Mini dress by Only    Still not over animal print V-neckBlouson sleevesElasticated cuffsWrap front Tie waist Regular fit True to size ,19.6,Only wrap mini dress in pink zebra print
ASOS Petite,multi,Petite dress by ASOS DESIGNYour new favorite dressPolka-dot printSweetheart neckLong sleevesRuched detailingCut-out detail to reverseBody-Conscious fitFigure-hugging cut,12.25,ASOS DESIGN Petite long sleeve sweetheart ruched mini dress in dot print
ASOS DESIGN,dark gray,Dress by ASOS DESIGN    Coming soon to your Saved ItemsDrawstring hoodOverhead designDrop shouldersGraphic print to backRibbed cuffsOversized fitRelaxed and roomy,18,ASOS DESIGN oversized hoodie dress with rodeo graphic back print in dark gray
TFNC Tall,dusky green,Tall dress by TFNC    Destination: dancefloorPleated design     High neck    Sleeveless style    Keyhole front     Thigh split     Zip-back fasteningRegular fitTrue to size,67,TFNC Tall Bridesmaid pleated maxi dress in dusky green
Miss Selfridge Petite,grey,Petite dress by Miss Selfridge         Cozy never looked so goodRoll-neckBlouson sleevesRibbed trims Slim fitClose-fitting cut ,18.9,Miss Selfridge Petite roll neck sweater dress in gray
TFNC Tall,pink,Tall dress by TFNC    Destination: dancefloorMultiway design Straps can be tied in different ways to create a variety of looks Zip-back fastening Regular fit True to size ,60,TFNC Tall Bridesmaid multiway maxi dress in pink
Rare,black,Dress by RareSerious add-to-bag potentialNotch lapelsPadded shouldersDouble-breasted styleSide pocketsCut-out back with lace-up fasteningRegular fitTrue to size,103,Rare London tie back blazer dress in black
JDY,black,"Midi dress by JDY     Simple, meet stylishPlain designRound neckVolume sleevesFitted cuffsBody-Conscious fitFigure-hugging cut",10.5,JDY jersey mini dress in black
Miss Selfridge,black,"Mini dress by Miss Selfridge    All-over floral printSweetheart neckLong sleevesShirred, stretch cuffsRuffle hemRegular fit",36,Miss Selfridge fit & flared mini dress in monochrome flirty print
Girl In Mind,floral,Dress by Girl In Mind    Cute dressAll-over floral printRound neckShort sleevesStretch waistButton-keyhole backRegular fitTrue to size,19,Girl In Mind angel sleeve skater dress in floral
Noisy May Tall,multi,Tall dress by Noisy May    The scroll is overColor-block design     Drawstring hood Partial zip opening     Drop shoulders    Fitted cuffsSide splitsRelaxed fitSlouchy cut,44.8,Noisy May Tall collegiate sweatshirt dress with color block in black
Missguided Plus,burgundy,Plus-size dress by Missguided          Throw-on appeal    Crew neck Drop shouldersRibbed cuffs Oversized fitRelaxed and roomy ,10.15,Missguided Plus oversized sweatshirt dress in burgundy
Girl In Mind,animal,Dress by Girl In Mind    Cute dressAll-over paisley printV-neckLong sleevesButton cuffsSkater skirtZip-back fasteningRegular fitTrue to size,24,Girl In Mind wrap skater dress in animal
New Look,gray heather,Dress by New Look    Can't go wrong in a hoodie Drawstring hood    Drop shoulders    Cinched waist Ribbed cuffs     Regular fit True to size ,13.65,New Look fitted hoodie dress in gray heather
Y.A.S,red,Midi dress by Y.A.S     Crack the dress codeV-neckLong sleevesWrap frontTie waistRegular fitTrue to size,23.1,Y.A.S wrap mini dress in red
New Look,black pattern,Dress by New Look    Cute dressAll-over printSpread collarButton placketLong sleevesDrawstring waistFrill hemRegular fitTrue to size,15.4,New Look tiered shirt dress in black abstract print
Monki,green,Midi dress by Monki      Part of our responsible edit    Crew neck    Drop shoulders     Ribbed cuffsSeam details    Split hemRelaxed fitLoose cut,26.4,Monki Coba organic cotton sweat midi dress in green
Mama.licious,black,"Maternity dress by Mama.Licious    Simple, meet stylishPlain designRound neckDrape detailLong sleevesAsymmetric waist seam    Body-Conscious fit    Designed to fit you from bump to baby",16.8,Mamalicious Maternity body-conscious midi dress with drape detail in black
Pieces,medium blue denim,Dress by PIECES    Your new favorite dressSpread collarButton placketLong sleevesButton chest pocketsButton cuffs    Oversized fitRelaxed and roomy,28,Pieces oversized denim dress in blue
ASOS DESIGN,pale khaki,Mini dress by ASOS DESIGN    Crack the dress codeCrew neck Volume sleevesTwist detail to bustZip-back fasteningSlim fitClose-fitting cut,17.5,ASOS DESIGN twist front mini dress in pale khaki
ASOS DESIGN,multi,Dress by ASOS DESIGN    Act casualColor-block stripe designSpread collarPartial button placketDrop shouldersRibbed trimsRelaxed fitSlouchy cut,16,ASOS DESIGN rugby dress in stripe
TFNC Petite,navy,Petite dress by TFNC    Destination: dancefloorHalterneck styleTie closureCan be worn in multiple waysRegular fit,60,TFNC Petite Bridesmaid multiway maxi dress in navy
Pieces,bright white,Dress by PIECES    Act casualHigh neckLong sleevesFine-rib trimsRegular fitTrue to size,40,Pieces high neck knitted dress in white
Mama.licious,multi,Maternity dress by Mama.Licious    Your new favorite dressAll-over smudge print    V-neckLong sleeves    Wrap frontTie waistRegular fit    Designed to fit you from bump to baby,19.2,Mamalicious Maternity wrap midi dress in black smudge print
Miss Selfridge,black,"Dress by Miss Selfridge    Cute dressDitsy floral printV-neckLong sleevesShirred, stretch shoulders and cuffsTiered hemSmock styleRegular fitTrue to size",33.75,Miss Selfridge smock dress in black ditsy print
Fashionkilla,black,Dress by Fashionkilla    Co-ordinating made easyHigh neckBuilt-in face covering WashableNon-medical gradeDesigned for personal use onlyPlease follow the care instructions when washingProduct is non-returnable for hygiene reasonsBody-Conscious fit Exclusive to ASOS,24.5,Fashionkilla exclusive body-conscious dress with added face covering option in black
TFNC Petite,mink,Petite dress by TFNC    Destination: dancefloorHigh round neckKeyhole frontSleeveless stylePleated frontSplit hemZip-back fasteningRegular fit,67,TFNC Petite Bridesmaid pleated maxi dress in mink
