brand,color,desc,retailPrice,title
brand,color,desc,retailPrice,title
QED London,mint,"Dress by QED London    Your no effort, effort-makerPlain designSpread collarButton-through fontChest pocketsTie waistSide splitsRegular fitTrue to size",29,QED London tie waist shirt dress in mint
Influence,black/white,"Dress by Influence    Add-to-bag material All-over spot print Square neck Ruffle strapsShirred, stretch bodiceRegular fit ",35,Influence midi dress in black and white spot
Influence,yellow,Tall dress by Influence    Gotta love a floral print V-neckAdjustable straps Cut-out bow front Elasticated waist Regular fit ,35,Influence Tall maxi dress in yellow floral print
Brave Soul,evening sand,T-shirt dress by Brave SoulTalk about a wardrobe staplePlain designCrew neckShort sleevesRegular fit,14,Brave Soul xena t-shirt dress in sand
ASOS Curve,blue stripe,Plus-size dress by ASOS DESIGN          The scroll is overStriped design     V-neck    Short sleeves    Button-through front Smock styleRegular fitTrue to size,22.5,ASOS DESIGN Curve button through smock midi dress in stripe
ASOS DESIGN,black,Mini dress by ASOS DESIGN    Part of our responsible editCowl neckFixed cami strapsPull-on styleBody-Conscious fit Figure-hugging cut ,10.85,ASOS DESIGN cami cowl neck mini dress in black
ASOS DESIGN,black,Dress by ASOS DESIGN    Crack the dress code    Plain designV-neckPuff sleeves    Elasticated cuffs     Wrap frontRelaxed fitSlouchy cut,17.4,ASOS DESIGN casual cotton poplin wrap front mini smock dress in black
ASOS DESIGN,sage green,Dress by ASOS DESIGN    Dress for the weather you wantSquare neckFixed straps    Frill overlayRegular fitTrue to size,17.6,ASOS DESIGN square neck sundress with overlayer frill in sage green
ASOS DESIGN,black,Mini dress by ASOS DESIGN    Dress for the weather you wantPlain designHalterneck styleAdjustable straps    Swing cut    Regular fitTrue to size,22.4,ASOS DESIGN halter neck swing mini sundress in black
ASOS DESIGN,black / nude dot,Midi dress by ASOS DESIGN     Crack the dress codeTiered designAll-over spot patternRound neckLong sleevesButton-keyhole backSmock styleRegular fitTrue to size,18,ASOS DESIGN long sleeve tiered smock midi dress in black/nude dots
ASOS DESIGN,white,Mini dress by ASOS DESIGN    Summer on-lockSquare neckTie strapsRuffle hem Regular fitTrue to size,22.4,ASOS DESIGN broderie tie strap pep hem mini dress in white
Missguided,sage,Dress by Missguided    Make some leg roomCrew neckPuff sleevesSmock styleRegular fitTrue to sizes,21,Missguided tiered smock dress with puff sleeves in sage
Just Me,sunflower,Dress by Just Me    Love at first scrollAll-over sunflower embroideryCrew neck Frill shouldersElasticated waist Tie-keyhole back Regular fit True to size ,135,Just Me bow back midi dress in sunflower floral print
Just Me,offwhite,Dress by Just Me    Dress for the weather you wantHigh frill neckPuff sleevesTie cuffsTiered skirtTie-back fasteningsSmock styleRegular fitTrue to size,87,Just Me eyelet smock mini dress in off white
Parisian,white,Dress by Parisian    This dress on repeatV-neckAdjustable cami strapsLace-up frontTie detailLace trimZip-back fasteningRegular fitTrue to size,35,Parisian cami strap lace insert swing dress in white
Parisian,blue/white,Dress by Parisian    Cute dressGingham designSquare neckPuff sleevesTie backZip-back fasteningRuffle hemSlim fitClose-fitting cut ,22.4,Parisian square neck gingham mini dress in blue
Puma,black,Dress by PUMA    A fresh addition Crew neckDropped shouldersPUMA logo to chestRelaxed fitA little bit slouchy,28,Puma t-shirt dress in black
ASOS DESIGN,sage green,Maxi dress by ASOS DESIGN    Part of our responsible editTiered designSquare neckSleeveless stylesRuffle trimsButton backRegular fitTrue to size,40,ASOS DESIGN tiered ruffle maxi dress in bubble texture in sage green
ASOS DESIGN,black,Mini dress by ASOS DESIGN    Act casualRound neckPuff sleevesElasticated cuffsButton-keyhole backSmock styleRegular fitTrue to size,23.2,ASOS DESIGN short sleeve smock mini dress in black
Collusion,black,Dress by COLLUSION    Act casualCrew neckDrop shouldersGraphic chest printRelaxed fitSlouchy cut Exclusive to ASOS,19.2,COLLUSION graphic print short sleeve t-shirt dress in black
In The Style,black,Mini dress by In The Style    Collaboration with Jacqueline JossaV-neckButton fasteningMid-length sleevesTrapeze styleRelaxed fitLoose cut,33.6,In The Style x Jac Jossa v neck trapeze mini dress in black
ASOS DESIGN,black,Dress by ASOS DESIGN    Crack the dress codeRound neckHalf sleevesFrill cuffsSuper-oversized fitVery relaxed and roomy,19.5,ASOS DESIGN super oversized frill sleeve smock in black
ASOS DESIGN,red,Mini dress by ASOS DESIGN    Crack the dress codePleated design Square neck Volume sleevesElasticated cuffsZip-side fastening Regular fitTrue to size,22.5,ASOS DESIGN square neck pleated mini skater dress in red
ASOS DESIGN,black,Mini dress by ASOS DESIGN    Cute dressAll-over floral embroideryCrew neckBell sleevesLace and cut-work trimsFlared skirtRegular fitTrue to size,46.5,ASOS DESIGN all over embroidered mini skater dress with lace trim in black
AX Paris,brushstroke,Dress by AX Paris    Crack the dress codeAll-over printCrew neckShort sleevesRuffle hemRegular fitTrue to size,45,AX Paris drop hem smock dress in brushstroke
Influence,sage/black,Dress by Influence    Trés cutePolka-dot printRound neckPuff sleevesTiered skirtTie-keyhole backRegular fitTrue to size,40,Influence cotton poplin polka dot midi dress in mint
Night Addict,fuschia,Dress by Night AddictAct casualCrew neckDrop shoulders'Baddie' text print on frontLogo detail to backRelaxed fitLoose cut,14.5,Night Addict baddie fuschia t-shirt dress
Influence,black/red,Dress by InfluenceCute dressAll-over heart printRound neckShort sleevesTie waistButton-keyhole backRuffle trimsRegular fitTrue to size,32,Influence tie-waist flippy hem mini dress in heart print
ASOS Tall,lilac,Tall dress by ASOS DESIGN    Dress casual? No thanksBeaded embellishmentRound neckLong sleevePleated skirtButton-keyhole backBack zip closureRegular fitTrue to size,101.25,ASOS DESIGN Tall embellished bodice maxi dress with tulle skirt
ASOS DESIGN,black,Midi dress by ASOS DESIGN     Serious add-to-bag potential     Round neck    Long sleeves    Tiered skirt Smock styleButton-keyhole backRegular fitTrue to size,28.8,ASOS DESIGN long sleeve tiered smock midi dress in black
ASOS Curve,white,Plus-size dress by ASOS DESIGNDress for the weather you want V-neckPuff sleevesElasticated cuffsRuffle trimSmock styleRegular fitTrue to size,28.8,ASOS DESIGN Curve eyelet V-neck smock dress with puff sleeves in white
New Look,blue pattern,Dress by New Look    Cute dressCheck designV-neckShort puff sleevesTie backRegular fitTrue to size,37.6,New Look puff sleeve midi tea dress in blue gingham
ASOS DESIGN,mocha,Midi dress by ASOS DESIGN     Your new favorite dress    V-neckRibbed cups     Double straps     Slim fitClose-fitting cut,11.7,ASOS DESIGN rib double cup strappy cami midi dress in mocha
ASOS DESIGN,black,Maxi dress by ASOS DESIGN    Add-to-bag material Scoop neck Fixed straps Gathered elasticized backRelaxed fit Loose cut ,28,ASOS DESIGN scoop maxi dress with ruched back in black
ASOS DESIGN,white,Mini dress by ASOS DESIGN    In case of warm weather Gathered neck Fixed straps Regular fit True to size ,20.8,ASOS DESIGN gathered neck strappy mini sundress in white
Luxe Palm,watercolor,Dress by Luxe Palm    Dreaming of the beachWatercolour print Crew neckLong sleevesTie hemBody-Conscious fitFigure-hugging cut,28.5,Luxe Palm mesh beach dress in watercolor print
ASOS DESIGN,black,Mini dress by ASOS DESIGN    The scroll is overV-neck Cami strapsAdjustable tie waistPleated skirtRegular fitTrue to size,16,ASOS DESIGN pleated cami mini dress with drawstring waist in black
Luxe Palm,orange tie dye,Dress by Luxe Palm    Dreaming of the beachTie-dye print Crew neckShort sleevesTie cuffs Body-Conscious fitFigure-hugging cut,28.5,Luxe Palm mesh beach dress with ruched detail in orange tie dye
Influence,brown,Dress by Influence    Still not over leopard printV-neckFlutter sleevesTie front Regular fit ,35,Influence tie front maxi dress in leopard print
ASOS DESIGN,gingham,"Mini dress by ASOS DESIGN    Cute dressAll-over gingham printV-neckPartial button placketShirred, stretch waistTiered skirtRegular fitTrue to size",28.8,ASOS DESIGN shirred waist button front tiered mini sundress in crinkle in gingham
Influence,black/white,Dress by Influence    Add-to-bag materialDot printV-neckAngel sleevesRegular fit,32,Influence mini dress in black and white spot
ASOS DESIGN,rose,Mini dress by ASOS DESIGN    Dress for the weather you want V-neckTie shoulder strapsV-backSmock styleRelaxed fitSlouchy cut Exclusive to ASOS,17.6,ASOS DESIGN bunny tie shoulder mini smock dress in rose
ASOS DESIGN,white,Mini dress by ASOS DESIGN    The scroll is over    Square neck    Frill sleeves    Smock style    Regular fitTrue to size,28.8,ASOS DESIGN broderie babydoll mini dress with square neck and short ruffle sleeve in white
ASOS DESIGN,khaki,"Mini dress by ASOS DESIGN    Dress for the weather you want Plunge neck Gathered sleevesShirred, stretch bodicePartial button placketTiered hem Regular fit True to size ",28.8,ASOS DESIGN shirred waist button front tiered mini sundress in crinkle in khaki
ASOS DESIGN,animal print,"Midi dress by ASOS DESIGN    Part of our responsible editAll-over animal printSquare neckSleeveless styleShirred, stretch bodice and strapsTiered skirtRuffle trimsRegular fitTrue to size",34.4,ASOS DESIGN cami midi sundress with raw edges in animal print
sister jane,blues,Midi dress by sister jane     Your new favorite dress     V-neck    Puff sleeves    Elasticated cuffsRuffle details     Tie waist     Tiered skirt Regular fitTrue to size,124.65,Dream Sister Jane midi dress with tiered skirt and ruffle sleeves in blue floral jacquard
sister jane,cream,Midi dress by sister jane     Crack the dress codeAll-over diamond patternRound neckPuff sleeves    Elasticated cuffsButton-keyhole backSmock styleRegular fitTrue to size,166.2,Dream Sister Jane midi smock dress in cream textured jacquard
ASOS DESIGN,stone,Petite dress by ASOS DESIGN    Vacay vibesPlain designElasticated bandeau neckSide pocketsSplit detailRelaxed fitLoose cut,25.6,ASOS DESIGN Petite bandeau maxi sundress with pockets in stone
ASOS DESIGN,stone,Mini dress by ASOS DESIGN    Coming soon to your Saved Items    High neck    Batwing sleeves    Drop shoulders    Open backRegular fitTrue to size,16.2,ASOS DESIGN brushed rib batwing cut out back mini dress in stone
Brave Soul Plus,black,Plus-size dress by Brave Soul         Crack the dress codeLeopard print crew neckShort sleevesRegular fitTrue to size,13,Brave Soul Plus Dawn leopard contrast ringer T-shirt dress in black
ASOS Curve,polka dot,Plus-size dress by ASOS DESIGN          Crack the dress codeAll-over spot printSpread collarButton placketShort sleevesTie waistRegular fitTrue to size,38.4,ASOS DESIGN Curve midi button down shirt dress in black polka dot
Flounce London,black,Dress by Flounce London    Your new go-toRound neck Short sleevesFrill cuffsSoft pleats to waist Smock style Regular fitTrue to size,19,Flounce London basic smock dress with ruffle sleeve in black
Missguided,black,"Dress by Missguided    This dress deserves a night outAll-over polka-dot printV-neckVolume sleevesElasticated cuffsShirred, stretch panel to reverseZip-back fasteningRegular fitTrue to sizeExclusive to ASOS",36,Missguided exclusive shirred skater dress with open back in black polka dot
ASOS DESIGN,navy/brown check,Midi dress by ASOS DESIGN     Serious add-to-bag potentialChecked designSpread collarDrop shoulders    Button cuffs    Button placketButton chest pocketsRelaxed fitLoose cut,40,ASOS DESIGN button through midi shirt dress in brushed check
New Look Plus,bk1 - black 1,Plus-size dress by New Look    Our kind of flowersAll-over floral printTie neckVolume sleevesElasticated cuffsTiered skirtFrill trimSmock styleRegular fitTrue to size,31.2,New Look Curve long sleeve tie neck frill detail smock in black pattern
ASOS DESIGN,khaki,Mini dress by ASOS DESIGN    Your new favorite dress    V-neckBlouson sleeves    Tie cuffs Pin-tuck detailing Pleated skirt     Tie backRegular fitTrue to size,30,ASOS DESIGN v-front v-back pleated mini smock dress with pin tucks in khaki
Missguided,green,Mini dress by Missguided    Cute dressFloral printV-neck with tie detailPuff sleevesElastic cuffsBody-conscious fitFigure-hugging cut,28,Missguided mini dress with puff sleeve in khaki floral
ASOS DESIGN,mid blue,Dress by ASOS DESIGNPart of our responsible editPoint collarButton placketPuff shouldersButton cuffsCurved hemRegular fitTrue to size,27,ASOS DESIGN denim puff sleeve shirt dress in mid wash
ASOS Curve,black dots,Plus-size dress by ASOS DESIGN          Your new go-toAll-over spot printCrew neckShort sleevesRegular fitTrue to size,17.4,ASOS DESIGN Curve mini tea dress in black based spot
New Look,white,Dress by New LookCute dress V-neckSpread collar Button placketHalf sleeves Fitted cuffsRegular fit True to size ,23.4,New Look poplin collar button up mini dress in white
Flounce London Plus,black,Plus-size dress by Flounce London    Your new favorite dressPlain design     Roll-neck    Long sleevesBody-Conscious fit Figure-hugging cut ,12.95,Flounce London Plus basic ribbed rollneck long sleeve dress in black
Influence,black,Dress by Influence    Your new favorite dressAll-over burnout patternV-neckButton placketShort sleevesRegular fitTrue to size,32,Influence burnout beach dress in black
Femme Luxe,black,Dress by Femme Luxe    Dress casual? No thanksSlash neckOne-shoulder styleThigh-high splitSlim fitClose-fitting cut ,12.2,Femme Luxe one shoulder slash neck maxi dress with high thigh split in black
Influence,green/ white,Dress by Influence    Trés cuteAll-over gingham printHigh neckShort sleevesTie cuffsSide splitTie backRegular fitTrue to size,38,Influence midi dress with tie sleeves in green gingham
Influence,white multi,Dress by Influence    Our kind of flowersAll-over floral printHigh neckShort sleevesTie-keyhole frontTiered skirtFrill trimRegular fitTrue to size,32,Influence mini dress in white floral print
ASOS DESIGN,apricot,"Beach dress by ASOS DESIGN    Dreaming of the beach    Tie halterneck styleCut-out frontElasticated waistShirred, stretch backDouble thigh splitsRegular fitTrue to size",32.2,ASOS DESIGN cross neck halter beach dress in apricot
ASOS Tall,khaki,Tall dress by ASOS DESIGN    Doing it for the glamHalter neckCut-out designSide splitsTie backRegular fitTrue to size,34.4,ASOS DESIGN tall cross waist halter maxi beach dress in khaki
ASOS DESIGN,tan wash,"Dress by ASOS DESIGN    The baggier, the better     Acid wash Crew neck Drop shouldersOversized fitRelaxed and roomy",13.05,ASOS DESIGN oversized long sleeve t-shirt dress in tan acid wash
ASOS DESIGN,white,Mini dress by ASOS DESIGN    The scroll is over    Square neck    Adjustable straps    Overlay detail     Side pockets     Regular fitTrue to size,22.4,ASOS DESIGN broderie strappy overlayer mini dress in white
ASOS DESIGN,green,Dress by ASOS DESIGN    Stick it on repeatPlain designCrew neckDrop shouldersSmock detail to reverseCurved hemOversized fitRelaxed and roomy,23.2,ASOS DESIGN oversized smock back sweat dress in green
New Look Plus,black,Plus-size dress by New Look          The scroll is overV-neck    Short sleeves    Belted waist     Regular fitTrue to size,27.3,New Look Curve belted dress in black
ASOS DESIGN,yellow,"Beach dress by ASOS DESIGN    Your bikini’s BFFPlunge neckCami strapsShirred, stretch waistTiered skirtTie backRegular fitTrue to size",22.4,ASOS DESIGN tiered skinny tie beach dress in yellow
Parisian,blue/white,Dress by Parisian    The scroll is over    Off-shoulder style    Ruffle overlay     Regular fit ,32,Parisian off shoulder frill overlay mini dress in blue
Influence,blue multi,"Dress by Influence    Brunch, anyone?Floral printSquare neckPuff sleevesElasticated cuffsTie backRegular fitTrue to size",32,Influence puff sleeve mini dress in ditsy floral print
Missguided,white,Mini dress by Missguided    The scroll is over    Spread collarVolume sleevesButton cuffsButton-through front    Cinched waistRegular fitTrue to size,38.4,Missguided shirt dress with cinched waist in white
ASOS DESIGN,multi,Midi dress by ASOS DESIGN     Crack the dress codeAll-over floral printScoop neckBlouson sleeves with ruffle trim    Tie cuffsElastic waist with tassel detailCrochet-lace trimsHanky hemRegular fitTrue to size,55.2,ASOS DESIGN drape ruffle midi dress with lace insert and tassel detail in blurred floral
In The Style Plus,blue polka,Plus-size dress by In The StyleCollaboration with influencer Lorna LuxeAll-over polka-dot printHigh neckPuff sleevesFitted waistRegular fitTrue to size,46.4,In The Style Plus x Lorna Luxe puff sleeve midi dress in navy polka dot print
ASOS DESIGN,black/white check,Midi dress by ASOS DESIGN     Crack the dress codeAll-over check printRound neckLong sleevesButton cuffsKeyhole backPeplum hemSmock styleRelaxed fitLoose cut,29.9,ASOS DESIGN oversized check midi smock dress with pephem in black and white
ASOS DESIGN,purple ash,Midi dress by ASOS DESIGN     Part of our responsible editCrew neckShort sleevesTiered skirtSmock styleRegular fitTrue to size,25.6,ASOS DESIGN tiered smock t-shirt midi dress in purple ash
ASOS DESIGN,black/yellow flirty,Mini dress by ASOS DESIGN    The scroll is overFloral print V-neck    Long sleeves    Elasticated cuffs Frill trimRegular fitTrue to size,27.5,ASOS DESIGN plisse V-neck long sleeve mini dress with ruffle hem and cuffs in black and yellow flirty floral
Stradivarius,black,"Midi dress by StradivariusWorn and shot by one of our models at homeAll-over dot printSquare neckLong sleevesShirred, stretch bodiceSide splitRegular fitTrue to size#AtHomeWithASOS",32.2,Stradivarius shirred top midi dress with slit detail in dot print
Brave Soul,light gray / black,Dress by Brave Soul    Your new go-toContrast crew neckShort sleevesRegular fitTrue to size,7.15,Brave Soul Lennie contrast ringer T-shirt dress in gray
Brave Soul,black,Dress by Brave Soul    The scroll is over     Plain designCrew neckShort sleevesSmock style    Regular fitTrue to size,15.5,Brave Soul lara smock dress in black
ASOS DESIGN,khaki,Midi dress by ASOS DESIGN    Your new go-to Revere collarButton placketThree-quarter-length sleevesAdjustable tie waistRegular fitTrue to size,40,ASOS DESIGN button through midi shirt dress with ruched waist in khaki
Collusion,blue/black,Mini dress by COLLUSION    Part of our responsible editGingham designAll-over letter and flower printRound neckShort sleevesButton-keyhole backSmock styleRegular fitTrue to sizeExclusive to ASOS,28,COLLUSION seersucker gingham mini smock dress in blue print
New Look,black pattern,Midi dress by New LookCute dress All-over print Shoulder pads Long sleeves Fitted cuffs     Split to hem    Regular fit True to size ,17.55,New Look shoulder pad midi dress with splits in black
Closet London,taupe,Dress by Closet    Très chicV-neckShort sleevesGathered detail to frontSide pocketsTie backZip-back fasteningRegular fitTrue to size,60.8,Closet London gathered tulip mini dress in taupe
ASOS Petite,blush,Petite dress by ASOS DESIGN    Crack the dress code Sequinned disc embellishment     Square neck     Cami straps     Regular fitTrue to size,85.6,ASOS DESIGN Petite disc sequin cami embellished mini dress
New Look,bright blue,Dress by New Look    Cute dressSquare neckShort puff sleevesOpen back with tieSmock styleRegular fitTrue to size,31.2,New Look tie back shirred poplin mini dress in bright blue
ASOS Petite,sage,"Petite dress by ASOS DESIGN    Simple, meet stylishPlain designRound neckShort sleevesSmock styleOversized fitRelaxed and roomy",25.6,ASOS DESIGN Petite oversized midi smock dress in sage
ASOS Curve,rust spot,Plus-size dress by ASOS DESIGNCrack the dress codeAll-over spot printRound neckLong sleevesTiered skirtSmock styleRegular fitTrue to size,28.8,ASOS DESIGN Curve long sleeve tiered smock midi dress in rust polka dot
ASOS DESIGN,black,Mini dress by ASOS DESIGN    This dress deserves a night out V-neckSheer puff sleevesWrap front Low backRuched seam through reversePull-on styleBody-Conscious fit Figure-hugging cut ,12.7,ASOS DESIGN textured mesh puff sleeve wrap mini dress in black
Club L London Plus,mushroom,Plus-size dress by Club L          Your new favorite dress    Ruched designSweetheart neckOff-shoulder styleLong sleevesBody-Conscious fitFigure-hugging cut,51.2,Club L London Plus sweetheart neck all over ruched midi pencil dress in mushroom
Influence,blue/white,Dress by Influence    The scroll is overStripe printSpread collarButton placketShort sleevesButton cuffsTiered skirtRegular fitTrue to size,32,Influence mini shirt dress in blue and white stripe
Stradivarius,blues,Dress by Stradivarius    Our kind of flowers All-over floral printSpread collar Button placketSleeveless styleRuffle trims Tiered hemSmock style Relaxed fit Loose cut ,18.9,Stradivarius sleeveless shirt dress in blue floral
ASOS DESIGN,mocha,Midi dress by ASOS DESIGN    Part of our responsible editPlain designCowl neckFixed cami strapsBody-Conscious fitFigure-hugging cut,10.5,ASOS DESIGN cami cowl neck midi dress in mocha
Wednesday's Girl,burgundy floral,Mini dress by Wednesday's Girl    Cute dress Floral design V-neck with tie detailLong sleevesRuched panel to bustRegular fitTrue to sizeExclusive to ASOS,20,Wednesday's Girl mini tea dress with ruched front in ditsy floral
ASOS DESIGN,blue/white gingham,Mini dress by ASOS DESIGN    Crack the dress codeCheck designSquare neckFixed strapsRuffle trimsBody-Conscious fitFigure-hugging cut,25.2,ASOS DESIGN shirred body-conscious mini sundress in pastel gingham
Lola May,pink,Dress by Lola May    Worn and shot by one of our models at home Polo collarPartial button placketDrop shouldersRelaxed fitLoose cut#AtHomeWithASOS ,26,Lola May long sleeve polo shirt dress in pink
ASOS DESIGN,mocha,Midi dress by ASOS DESIGN    This dress deserves a night outRuched designHalterneck styleKeyhole frontOpen backBody-Conscious fitFigure-hugging cut,18,ASOS DESIGN halter super ruched key hole midi dress in mocha
Influence,blue multi,"Dress by Influence    Brunch, anyone?Floral design Crew neck Puff sleevesElasticated waistButton-keyhole backTiered skirtRegular fitTrue to size",40,Influence puff sleeve cotton poplin midi dress in floral print
ASOS DESIGN,mixed ditsy floral,"Mini dress by ASOS DESIGN    Part of our responsible edit Shirred, stretch designMixed floral print V-neckAdjustable tie straps Frill trim Regular fit True to size ",32,ASOS DESIGN shirred mini sundress in mixed floral print
ASOS Curve,black,Plus-size dress by ASOS DESIGN          Cute topCrew neckShort sleeves with lace trimsOversized fitRelaxed and roomy ,20.8,ASOS DESIGN Curve oversized lace t-shirt dress in black
ASOS DESIGN,white,Dress by ASOS DESIGN    Part of our responsible edit Tiered design Sleeveless styleV-neckAdjustable cami straps Button placketTie back Regular fit True to size ,32,ASOS DESIGN button through tiered cami midi sundress in white
New Look,black pattern,Mini dress by New Look    Your new favorite dress Printed design     V-neck    Short sleeves    Tie cuffsRegular fitTrue to size,15.3,New Look tie sleeve mini dress in black pattern
Lola May,black,Dress by Lola May    Your new favorite dress    V-neck    Volume sleevesElasticated cuffsTie back    Tiered hemRelaxed fitLoose cut,24.8,Lola May tiered dress with volume sleeves in black
Rhythm,cream,Dress by Rhythm    Add-to-bag material V-neckShort sleevesWrap frontTie waistRegular fitTrue to size,53.2,Rhythm Sofia wrap front dress in sand
ASOS DESIGN,forest green,Midi dress by ASOS DESIGN     Crack the dress codePlain designRound neckLong sleevesKeyhole backSmock styleRegular fitTrue to size,28.8,ASOS DESIGN long sleeve tiered smock midi dress in forest green
In The Style,black,Dress by In The Style    Collaboration with Lorna LuxeRound neckThree-quarter-length sleevesRuffle trims    Regular fitTrue to sizes,25.2,In The Style x Lorna Luxe frill detail skater dress in black
ASOS Tall,gold,Tall dress by ASOS DESIGN    The scroll is over     V-neckOne-sleeve design     Wrap frontTwist detail Thigh split     Zip-back fastening Regular fitTrue to size,32,ASOS DESIGN Tall one sleeve twist high slit midi dress in gold
ASOS Curve,pine green,Plus-size dress by ASOS DESIGN    Part of our responsible editTiered designCrew neckShort sleevesSmock styleRegular fitTrue to size,25.6,ASOS DESIGN Curve tiered smock t-shirt midi dress in pine green
In The Style,blue,Dress by In The Style    Collaboration with influencer Lorna LuxeV-neckPuff sleeves    Elasticated cuffs Smock styleRegular fitTrue to size,44.8,In The Style x Lorna Luxe poplin ruched detail smock dress in blue
ASOS DESIGN,black,Mini dress by ASOS DESIGN    The scroll is overRuched design Bardot neckOff-shoulder styleFlared sleevesBody-Conscious fitFigure-hugging cut,14.3,ASOS DESIGN ruched off shoulder front flare sleeve mini dress in black
Wednesday's Girl,black dots,Dress by Wednesday's Girl    Crack the dress codePolka-dot printButton-keyhole backPeplum hemSmock styleRegular fitTrue to sizeExclusive to ASOS,10.15,Wednesday's Girl mini smock dress with peplum hem in smudge polka dot 
Brave Soul,black,Dress by Brave Soul    The scroll is over     High neck    Long sleeves    Smock styleRegular fitTrue to size,10.8,Brave Soul lizzie high neck smock dress in black
ASOS Curve,black based floral,Plus-size dress by ASOS DESIGN          As seen on one of our ASOS modelsAll-over daisy printV-neckLong sleevesWrap frontPeplum hemFrill trimsRegular fitTrue to size,20,ASOS DESIGN Curve mini wrap dress with frill neck and pep hem in black base daisy print
